annotation_ID,annotator_ID,segment_ID,category,attr_val,policy_ID,segment_text
24278,118,9,Other,"{""Other Type"": {""selectedText"": ""Additional information regarding the requirements of VISA's CISP and Mastercard's Site Data Protection program (SDP) can be found on the VISA, Inc. and MasterCard International Web sites."", ""startIndexInSegment"": 2121, ""endIndexInSegment"": 2308, ""value"": ""Other""}}",1306," Protection of Cardholder Data and Customer Data    Chase Paymentech has implemented various measures, including appropriate administrative, technical and physical safeguards, designed to ensure the security and confidentiality of Cardholder Data and Customer Data, protect against anticipated threats or hazards to the security or integrity of such information, and protect against unauthorized access to or use of such information. Such measures may include, among others, encryption, physical access security and other appropriate technologies. Chase Paymentech continually reviews and enhances its security systems, as necessary. Chase Paymentech is subject to the detailed rules and regulations of the various credit and debit card organizations and networks (i.e. VISA, MasterCard, American Express, NYCE, Star, etc.), relating to the security and safeguarding of Cardholder Data, including, but not limited to, the Payment Card Industry Data Security Standards (""PCI""), VISA Inc.'s Cardholder Information Security Program (""CISP"") and MasterCard International's Site Data Protection Program (""SDP""). Chase Paymentech endeavors to comply with all such rules at all times. Pursuant to such rules and regulations, Chase Paymentech is required to undergo periodic third-party assessments and periodic network scans to ensure that, among other things, Chase Paymentech has installed and maintains a firewall configuration to protect data; does not use vendor-supplied defaults for system passwords and other security parameters; protects stored data; encrypts transmission of Cardholder Data and sensitive information across public networks; uses and regularly updates anti-virus software; develops and maintains secure systems and applications; restricts access to data to those with a business need-to-know; tracks and monitors all access to network resources and Cardholder Data; regularly tests security systems and processes; assigns a unique ID to each person with computer access; restricts physical access to Cardholder Data; and maintains a policy that addresses information security. Additional information regarding the requirements of VISA's CISP and Mastercard's Site Data Protection program (SDP) can be found on the VISA, Inc. and MasterCard International Web sites.  "
24251,118,16,Other,"{""Other Type"": {""selectedText"": ""Please check the relevant third party website for more information about their use of cookies. Where this site allows such cookies to be set or you access other websites from this site using the links provided, the operators of these websites will use cookies in accordance with their own cookies policy, which may differ from ours."", ""startIndexInSegment"": 537, ""endIndexInSegment"": 869, ""value"": ""Other""}}",1306,"Many cookies are designed to give you optimal usage of the web. For example, we use cookies to enable you to improve your user experience when using our website, e.g. a cookie which recognizes if your browser supports specific technology features. This helps, for example, in enabling web pages to be loaded more quickly when you request the download of a large file. In addition to cookies which send information to us, we also use cookies which collect information and send it to third parties. An example of this is Google Analytics. Please check the relevant third party website for more information about their use of cookies. Where this site allows such cookies to be set or you access other websites from this site using the links provided, the operators of these websites will use cookies in accordance with their own cookies policy, which may differ from ours.As with first party cookies, you are able to block third party cookies through your browser settings. Some of our cookies may collect and store your personal information, such as your name or email address. We are committed to respecting and protecting your privacy and will ensure that all personal information collected by us is kept and treated in accordance with this privacy policy.   "
24259,118,17,Other,"{""Other Type"": {""selectedText"": ""To manage your use of cookies there are various resources available to you, for example the \""Help\"" section on your browser may assist you."", ""startIndexInSegment"": 484, ""endIndexInSegment"": 622, ""value"": ""Other""}}",1306,"   Refusing Cookies on this Site.  Most browsers are initially set to accept cookies. However, you have the ability to disable cookies if you wish, generally through changing your internet software browsing settings. It may also be possible to configure your browser settings to enable acceptance of specific cookies or to notify you each time a new cookie is about to be stored on your computer enabling you to decide whether to accept or reject the cookie. To manage your use of cookies there are various resources available to you, for example the ""Help"" section on your browser may assist you. You can also disable or delete the stored data used by technology similar to cookies, such as Local Shared Objects or Flash cookies, by managing your browser's ""add-on settings"" or visiting the website of its manufacturer. As our cookies allow you to access some of our website's essential features we recommend that you leave cookies enabled, otherwise, if cookies are disabled, it may mean that you experience reduced functionality or will be prevented from using this site altogether.    "
13184,103,18,Other,"{""Other Type"": {""endIndexInSegment"": 464, ""startIndexInSegment"": 9, ""selectedText"": ""Third-Party Web Sites. Chase Paymentech may create links to third-party Web sites. In addition, Chase Paymentech may authorize third-parties to create links to Chase Paymentech websites. Chase Paymentech is not responsible for the content or privacy practices employed by third-party Web sites. Nor does Chase Paymentech control or warrant the utility, merchantability or workmanship of the products or services offered at third-party Web sites."", ""value"": ""Other""}}",1306," Third-Party Web Sites.  Chase Paymentech may create links to third-party Web sites. In addition, Chase Paymentech may authorize third-parties to create links to Chase Paymentech websites. Chase Paymentech is not responsible for the content or privacy practices employed by third-party Web sites. Nor does Chase Paymentech control or warrant the utility, merchantability or workmanship of the products or services offered at third-party Web sites.  "
24181,118,22,Other,"{""Other Type"": {""selectedText"": ""To learn more about the Safe Harbor program, and to view Paymentech, LLC's certification, please visit http://www.export.gov/safeharbor/."", ""startIndexInSegment"": 449, ""endIndexInSegment"": 586, ""value"": ""Other""}}",1306,"Paymentech, LLC, complies with the U.S.-EU Safe Harbor Framework and the U.S.-Swiss Safe Harbor Framework as set forth by the U.S. Department of Commerce regarding the collection, use, and retention of personal information from European Union member countries and Switzerland. Paymentech, LLC, has certified that it adheres to the Safe Harbor Privacy Principles of notice, choice, onward transfer, security, data integrity, access, and enforcement. To learn more about the Safe Harbor program, and to view Paymentech, LLC's certification, please visit http://www.export.gov/safeharbor/.  "
24185,118,25,Other,"{""Other Type"": {""selectedText"": ""(Last modified January, 2015)"", ""startIndexInSegment"": 0, ""endIndexInSegment"": 29, ""value"": ""Other""}}",1306,"(Last modified January, 2015)"
10799,116,2,Other,"{""Other Type"": {""endIndexInSegment"": 751, ""startIndexInSegment"": 706, ""selectedText"": ""What else should you know about your privacy-"", ""value"": ""Other""}}",1259,This Privacy Statement answers the following questions:     What information does The Motley Fool gather about you-     How does The Motley Fool use your personal information-     Will The Motley Fool disclose any of your personal information-     What kind of security measures do we take to protect your information from accidental loss or disclosure-     Will The Motley Fool use your information for direct mailings-     How can you deactivate your account or correct or revise information that we have about you-     How do we respect children's privacy-     What else should you know about your privacy-     Does the Motley Fool participate in the Safe Harbor program-     How will you know whether The Motley Fool's privacy policy has changed-  
10868,116,16,Other,"{""Other Type"": {""endIndexInSegment"": 125, ""startIndexInSegment"": 0, ""selectedText"": ""If you would like more information about the information we are receiving and your choices with respect to that data, please:"", ""value"": ""Other""}}",1259,"If you would like more information about the information we are receiving and your choices with respect to that data, please:     visit the DAA opt-out program the Evidon opt-out program to learn how to opt out of having your information collected in browsers for ad serving purposes;     download the Evidon Ad Control application, available for iOS and Android, to learn how to opt out of having your information collected in mobile apps; and     visit the Network Advertising Initiative's opt out page.  "
10988,116,28,Other,"{""Other Type"": {""endIndexInSegment"": 198, ""startIndexInSegment"": 10, ""selectedText"": ""If you use our recommendation service to email one of our articles to a friend, The Motley Fool will automatically send this person a one-time email, with the recommended article attached."", ""value"": ""Other""}}",1259,"  If you use our recommendation service to email one of our articles to a friend, The Motley Fool will automatically send this person a one-time email, with the recommended article attached. The email address you give us will appear on the ""From"" line of the email, thereby disclosing this information to whoever opens and reads the email. Similarly, if you send email from our site, by using ""Reply to Author"" or ""Email this Post,"" your address may appear as the return address of that email.  "
10210,121,42,Other,"{""Other Type"": {""endIndexInSegment"": 349, ""startIndexInSegment"": 0, ""selectedText"": ""Please note: If you purchase products or services from us, or if you register for an account with us, we may contact you to confirm your purchase, subscription, or registration, or to provide you with information about its terms or features. You may wish to keep these transactional or relationship emails, to help you use our products and services."", ""value"": ""Other""}}",1259,"Please note: If you purchase products or services from us, or if you register for an account with us, we may contact you to confirm your purchase, subscription, or registration, or to provide you with information about its terms or features. You may wish to keep these transactional or relationship emails, to help you use our products and services.  "
11052,116,42,Other,"{""Other Type"": {""endIndexInSegment"": 349, ""startIndexInSegment"": 242, ""selectedText"": ""You may wish to keep these transactional or relationship emails, to help you use our products and services."", ""value"": ""Other""}}",1259,"Please note: If you purchase products or services from us, or if you register for an account with us, we may contact you to confirm your purchase, subscription, or registration, or to provide you with information about its terms or features. You may wish to keep these transactional or relationship emails, to help you use our products and services.  "
12275,117,42,Other,"{""Other Type"": {""endIndexInSegment"": 348, ""startIndexInSegment"": 102, ""selectedText"": ""we may contact you to confirm your purchase, subscription, or registration, or to provide you with information about its terms or features. You may wish to keep these transactional or relationship emails, to help you use our products and services"", ""value"": ""Other""}}",1259,"Please note: If you purchase products or services from us, or if you register for an account with us, we may contact you to confirm your purchase, subscription, or registration, or to provide you with information about its terms or features. You may wish to keep these transactional or relationship emails, to help you use our products and services.  "
11080,116,50,Other,"{""Other Type"": {""endIndexInSegment"": 153, ""startIndexInSegment"": 0, ""selectedText"": ""Also please be aware that when you post messages on our discussion boards, people can respond to your posts through our \""Reply to Author\"" email function."", ""value"": ""Other""}}",1259,"Also please be aware that when you post messages on our discussion boards, people can respond to your posts through our ""Reply to Author"" email function. Of course, they still will not know your email address (unless you send email to them).  "
12288,117,50,Other,"{""Other Type"": {""endIndexInSegment"": 241, ""startIndexInSegment"": 0, ""selectedText"": ""Also please be aware that when you post messages on our discussion boards, people can respond to your posts through our \""Reply to Author\"" email function. Of course, they still will not know your email address (unless you send email to them)."", ""value"": ""Other""}}",1259,"Also please be aware that when you post messages on our discussion boards, people can respond to your posts through our ""Reply to Author"" email function. Of course, they still will not know your email address (unless you send email to them).  "
10198,121,52,Other,"{""Other Type"": {""endIndexInSegment"": 486, ""startIndexInSegment"": 0, ""selectedText"": ""While we do our best to protect your personal information, The Motley Fool cannot ensure or warrant the security of any information you transmit to us, and you do so at your own risk. What does all of this mean- Just as in the investing world, you must protect yourself. You are responsible for maintaining the secrecy of any password and/or account information. Please be careful and responsible whenever you are online, especially when using a computer that other people can use also."", ""value"": ""Other""}}",1259,"While we do our best to protect your personal information, The Motley Fool cannot ensure or warrant the security of any information you transmit to us, and you do so at your own risk. What does all of this mean- Just as in the investing world, you must protect yourself. You are responsible for maintaining the secrecy of any password and/or account information. Please be careful and responsible whenever you are online, especially when using a computer that other people can use also.  "
12291,117,53,Other,"{""Other Type"": {""endIndexInSegment"": 441, ""startIndexInSegment"": 183, ""selectedText"": ""If you follow links from our site to others, you should be aware that you are doing business with those other sites, which have their own privacy and data collection practices. The Motley Fool has no responsibility or liability for these independent policies"", ""value"": ""Other""}}",1259,"Many of our advertisers or partners, such as brokerages, merchants, or data providers, link from our site to areas on their own sites where they sell their own products and services. If you follow links from our site to others, you should be aware that you are doing business with those other sites, which have their own privacy and data collection practices. The Motley Fool has no responsibility or liability for these independent policies (and we may not even know what they are). For more information regarding a site and its privacy policies, check that site.  "
22976,121,0,Other,"{""Other Type"": {""selectedText"": ""Last Revised: April, 2011"", ""startIndexInSegment"": 44, ""endIndexInSegment"": 69, ""value"": ""Other""}}",635," Privacy Policy    Last Revised: April, 2011  "
20050,95,3,Other,"{""Other Type"": {""selectedText"": ""ESRB Privacy Online is a third-party seal provider whose mission is to protect consumers' online privacy and make the Internet a secure, reliable and private place to share information and conduct business. ESRB Privacy Online promotes and enforces established principles and guidelines for fair information collection practices that include requirements of full disclosure, notice and informed consent."", ""startIndexInSegment"": 0, ""endIndexInSegment"": 408, ""value"": ""Other""}}",635,"ESRB Privacy Online is a third-party seal provider whose mission is to protect consumers' online privacy and make the Internet a secure, reliable and private place to share information and conduct business. ESRB Privacy Online promotes and enforces established principles and guidelines for fair information collection practices that include requirements of full disclosure, notice and informed consent.  "
20051,95,4,Other,"{""Other Type"": {""selectedText"": ""Whenever you visit a website that displays the ESRB Privacy Online certification seal, you can expect to be notified of: What personal information may be collected and by what means Who, if anyone, is collecting your personal information How this information may be used, including who, if anyone, it might be shared with The consequences, if any, resulting from your refusal to provide personal information How you can access and, if necessary, change the personal information a company maintains How a company ensures data security, quality and integrity Where and how to ask questions or file complaints"", ""startIndexInSegment"": 0, ""endIndexInSegment"": 646, ""value"": ""Other""}}",635,"Whenever you visit a website that displays the ESRB Privacy Online certification seal, you can expect to be notified of:   What personal information may be collected and by what means  Who, if anyone, is collecting your personal information  How this information may be used, including who, if anyone, it might be shared with  The consequences, if any, resulting from your refusal to provide personal information  How you can access and, if necessary, change the personal information a company maintains  How a company ensures data security, quality and integrity  Where and how to ask questions or file complaints "
22982,121,5,Other,"{""Other Type"": {""selectedText"": ""This policy applies to the websites us.playstation.com and naughtydog.com. In addition, we own several other domain names that point to us.playstation.com. From time to time, we may add new websites not listed above, and will provide a link to this policy or the applicable privacy policy."", ""startIndexInSegment"": 34, ""endIndexInSegment"": 323, ""value"": ""Other""}}",635,"THIS POLICY APPLIES TO:   This policy applies to the websites us.playstation.com and naughtydog.com. In addition, we own several other domain names that point to us.playstation.com. From time to time, we may add new websites not listed above, and will provide a link to this policy or the applicable privacy policy. Finally, we collect information via dynamic in-game advertising that is served to some online PlayStation3 games. By use of our websites and games that have dynamic in-game advertising, you signify your assent to SCEA's privacy policy. If you do not agree to this policy, please do not use our websites or games with dynamic in-game advertising.  "
22984,121,6,Other,"{""Other Type"": {""selectedText"": ""PlayStationNetwork In parts of North America and South America, Sony Network Entertainment America Inc. (\""SNEA\"") operates Sony Online Services, a network of online games, movies, music, other media and content and communication services. PlayStation Network (\""PSN\"") is one of these Sony Online Services. With a Sony Online Services or Sony Entertainment Network account, users can purchase goods and services from SNEA through Sony Online Services and may have the opportunity to participate in various network community activities. Users can register for and log into a Sony Entertainment Network account via us.playstation.com. Collection and use of your information by Sony Online Services is governed by the SNEA Privacy Policy, which can be found here: http://www.qriocity.com/us/en/legal-privacy."", ""startIndexInSegment"": 36, ""endIndexInSegment"": 863, ""value"": ""Other""}}",635,"THIS POLICY DOES NOT APPLY TO:   PlayStationNetwork   In parts of North America and South America, Sony Network Entertainment America Inc. (""SNEA"") operates Sony Online Services, a network of online games, movies, music, other media and content and communication services. PlayStation Network (""PSN"") is one of these Sony Online Services. With a Sony Online Services or Sony Entertainment Network account, users can purchase goods and services from SNEA through Sony Online Services and may have the opportunity to participate in various network community activities. Users can register for and log into a Sony Entertainment Network account via us.playstation.com. Collection and use of your information by Sony Online Services is governed by the SNEA Privacy Policy, which can be found here:   http://www.qriocity.com/us/en/legal-privacy.  "
22985,121,7,Other,"{""Other Type"": {""selectedText"": ""SCEA may provide links to the websites of our promotional partners and licensed software publishers, our affiliates or other entities that we own or control. This privacy policy does not apply to third-party websites and treatment of any personal information you provide on those sites is subject to the applicable third party's individual privacy policy."", ""startIndexInSegment"": 11, ""endIndexInSegment"": 376, ""value"": ""Other""}}",635,"Links   SCEA may provide links to the websites of our promotional partners and licensed software publishers, our affiliates or other entities that we own or control. This privacy policy does not apply to third-party websites and treatment of any personal information you provide on those sites is subject to the applicable third party's individual privacy policy.  "
20635,95,10,Other,"{""Other Type"": {""selectedText"": ""Some of our website activities require that the user log in using a PlayStationNetwork (\""PSN\"") account; for information regarding SNEA's collection of information in association with a Sony Entertainment Network account, please see their Privacy Policy http://www.qriocity.com/us/en/legal-privacy. On our websites, PlayStation Network log in information is being authenticated by SNEA, not SCEA."", ""startIndexInSegment"": 0, ""endIndexInSegment"": 395, ""value"": ""Other""}}",635,"Some of our website activities require that the user log in using a PlayStationNetwork (""PSN"") account; for information regarding SNEA's collection of information in association with a Sony Entertainment Network account, please see their Privacy Policy http://www.qriocity.com/us/en/legal-privacy. On our websites, PlayStation Network log in information is being authenticated by SNEA, not SCEA.  "
15337,103,11,Other,"{""Other Type"": {""selectedText"": ""SCEA may require a Sony Entertainment Network account in connection with: Participation in online contests, sweepstakes or other promotions Inclusion in our email newsletter program Participation on our message boards Access to special sections of official game websites"", ""startIndexInSegment"": 0, ""endIndexInSegment"": 295, ""value"": ""Other""}}",635,"SCEA may require a Sony Entertainment Network account in connection with:   Participation in online contests, sweepstakes or other promotions  Inclusion in our email newsletter program  Participation on our message boards  Access to special sections of official game websites "
20634,95,11,Other,"{""Other Type"": {""selectedText"": ""SCEA may require a Sony Entertainment Network account in connection with: Participation in online contests, sweepstakes or other promotions Inclusion in our email newsletter program Participation on our message boards Access to special sections of official game websites"", ""startIndexInSegment"": 0, ""endIndexInSegment"": 295, ""value"": ""Other""}}",635,"SCEA may require a Sony Entertainment Network account in connection with:   Participation in online contests, sweepstakes or other promotions  Inclusion in our email newsletter program  Participation on our message boards  Access to special sections of official game websites "
23022,121,24,Other,"{""Other Type"": {""selectedText"": ""SCEA's consumer services department may direct consumers to the consumer services departments of other companies with whom SCEA has arranged to provide consumer service, so that the consumer receives appropriate assistance."", ""startIndexInSegment"": 526, ""endIndexInSegment"": 749, ""value"": ""Other""}}",635,"SCEA's consumer services department maintains information obtained from consumers who contact or submit an online complaint so that we may assist these customers with current or future service issues. SCEA's consumer services department may collect additional information such as credit card, personal check information, if a consumer contacts consumer services to request repair of, exchange of, or service on, a PlayStation system. Consumer Services uses this information only for payment and payment verification purposes. SCEA's consumer services department may direct consumers to the consumer services departments of other companies with whom SCEA has arranged to provide consumer service, so that the consumer receives appropriate assistance.  "
