annotation_ID,annotator_ID,segment_ID,category,attr_val,policy_ID,segment_text
12041,118,24,Other,"{""Other Type"": {""endIndexInSegment"": 451, ""startIndexInSegment"": 53, ""selectedText"": ""This website may contain links to other websites. We provide these links solely for your convenience and information. Different websites have different privacy practices. You should always check the privacy notice of the specific site you're visiting to understand the privacy practices associated with that site. We are not responsible for the content or privacy practices of third party websites."", ""value"": ""Other""}}",746, Links To Other Websites    This website may contain links to other websites. We provide these links solely for your convenience and information. Different websites have different privacy practices. You should always check the privacy notice of the specific site you're visiting to understand the privacy practices associated with that site. We are not responsible for the content or privacy practices of third party websites.  
22575,118,7,Other,"{""Other Type"": {""selectedText"": ""Be aware that we are not responsible for any personal information you choose to make public via your public activities,"", ""startIndexInSegment"": 466, ""endIndexInSegment"": 585, ""value"": ""Other""}}",1636,"If you have registered for an account on one of our Web Sites, we will track and aggregate your public activities on that Web Site. By choosing to participate in public activities, you are electing to share and display such public activities via our Web Sites. Furthermore, public activities may be included in RSS feeds, APIs and made available to other websites via other formats. As a result, your public activities may appear on other websites, blogs, or feeds. Be aware that we are not responsible for any personal information you choose to make public via your public activities, and you agree that any such sharing will be deemed to have been done by you, not by SIDEARM Sports.  "
22454,118,9,Other,"{""Other Type"": {""selectedText"": ""For more information about how AddThis collects data, please read their privacy policy at http://www.addthis.com/privacy."", ""startIndexInSegment"": 217, ""endIndexInSegment"": 338, ""value"": ""Other""}}",1636,"We have engaged with a third party service called AddThis to provide us information, reports and analysis about users' engagement with our content. All data collected by AddThis on our behalf is owned and used by us. For more information about how AddThis collects data, please read their privacy policy at http://www.addthis.com/privacy.  "
22478,118,16,Other,"{""Other Type"": {""selectedText"": ""For more information about how Google Analytics collects data, please read their privacy policy at http://www.google.com/intl/en/policies/privacy/."", ""startIndexInSegment"": 442, ""endIndexInSegment"": 589, ""value"": ""Other""}}",1636,"Analytics Technologies. We have engaged with a third party service called Google Analytics to provide us information, reports and analysis about the usage, browsing patterns of users of the SIDEARM Services. Google Analytics tracks and analyzes non-personally identifiable usage and volume statistical information from our visitors and customers on our Web Sites. All data collected by Google Analytics on our behalf is owned and used by us. For more information about how Google Analytics collects data, please read their privacy policy at http://www.google.com/intl/en/policies/privacy/.  "
22499,118,23,Other,"{""Other Type"": {""selectedText"": ""Your access to our Web Sites should not be affected if you do not accept cookies served by third parties."", ""startIndexInSegment"": 0, ""endIndexInSegment"": 105, ""value"": ""Other""}}",1636,Your access to our Web Sites should not be affected if you do not accept cookies served by third parties.  
22517,118,28,Other,"{""Other Type"": {""selectedText"": ""For details about SIDEARM Sports email, please see the section labeled \""Our Email Policy?\"""", ""startIndexInSegment"": 171, ""endIndexInSegment"": 261, ""value"": ""Other""}}",1636,"Email Newsletters   SIDEARM Sports will periodically send you email newsletters or promotional email about services offered by SIDEARM Sports and its advertisers. For details about SIDEARM Sports email, please see the section labeled ""Our Email Policy?""  "
22581,118,34,Other,"{""Other Type"": {""selectedText"": ""(See the \""Compliance With Legal Process\"" section of this Privacy Policy.)"", ""startIndexInSegment"": 293, ""endIndexInSegment"": 366, ""value"": ""Other""}}",1636,"We reserve the right to disclose your opt-out information to third parties so they can suppress your name from future solicitations, in accordance with applicable laws. We may occasionally release personal information as required by law, for example, to comply with a court order or subpoena. (See the ""Compliance With Legal Process"" section of this Privacy Policy.)  "
22541,118,41,Other,"{""Other Type"": {""selectedText"": ""We suggest that you exercise caution when deciding to disclose any personal or confidential information in emails."", ""startIndexInSegment"": 165, ""endIndexInSegment"": 279, ""value"": ""Other""}}",1636,"Emails From You. If you send us emails, you should be aware that information disclosed in emails may not be secure or encrypted and thus may be available to others. We suggest that you exercise caution when deciding to disclose any personal or confidential information in emails. We will use your email address to respond directly to your questions or comments.  "
22545,118,44,Other,"{""Other Type"": {""selectedText"": ""Keep in mind, however, that no method of transmission over the Internet, or method of electronic storage, is"", ""startIndexInSegment"": 261, ""endIndexInSegment"": 369, ""value"": ""Other""}}",1636,"PROTECTING YOUR INFORMATION   To prevent unauthorized access, maintain data accuracy and ensure the appropriate use of information, we have put in place commercially reasonable physical, technical and administrative controls to protect the information. Keep in mind, however, that no method of transmission over the Internet, or method of electronic storage, is 100PARAGRAPH_START ADDITIONAL INFORMATION  "
24339,118,4,Other,"{""Other Type"": {""selectedText"": ""Should you wish to block cookies through your web browser, you may still purchase products through our Customer Service Department at 1-877-299-8366."", ""startIndexInSegment"": 239, ""endIndexInSegment"": 388, ""value"": ""Other""}}",503,"If you wish, you can set your browser to refuse cookies. However, keep in mind that cookies are required to place an online order and for other user-friendly Site functions, so blocking cookies will negatively impact your Site experience. Should you wish to block cookies through your web browser, you may still purchase products through our Customer Service Department at 1-877-299-8366.  "
24356,118,10,Other,"{""Other Type"": {""selectedText"": ""We do not review, control or monitor the practices, information or materials on any other websites, and are not responsible or liable for the communications, practices, information, content or materials from any of those sites. You are responsible for understanding and adhering to any other website's terms and conditions."", ""startIndexInSegment"": 434, ""endIndexInSegment"": 757, ""value"": ""Other""}}",503," Links and Third-Party Content    Our Sites may contain links to other websites, which are not under our control. We provide these links as a customer convenience and to allow advertisers to promote their own sites or products, and do not endorse those sites, companies or their products or services. Also, when you link to our Sites from another site, the originating site may collect information about you. We do not review, control or monitor the practices, information or materials on any other websites, and are not responsible or liable for the communications, practices, information, content or materials from any of those sites. You are responsible for understanding and adhering to any other website's terms and conditions.  "
13461,103,18,Other,"{""Other Type"": {""endIndexInSegment"": 210, ""startIndexInSegment"": 0, ""selectedText"": ""Overview of Changes from Previous Policy: We added clarification regarding the use of collected information, consolidated all BWW privacy policies into one, and revised the Policy to comply with California law."", ""value"": ""Other""}}",503,"Overview of Changes from Previous Policy: We added clarification regarding the use of collected information, consolidated all BWW privacy policies into one, and revised the Policy to comply with California law.  "
13966,95,18,Other,"{""Other Type"": {""endIndexInSegment"": 210, ""startIndexInSegment"": 0, ""selectedText"": ""Overview of Changes from Previous Policy: We added clarification regarding the use of collected information, consolidated all BWW privacy policies into one, and revised the Policy to comply with California law."", ""value"": ""Other""}}",503,"Overview of Changes from Previous Policy: We added clarification regarding the use of collected information, consolidated all BWW privacy policies into one, and revised the Policy to comply with California law.  "
24369,118,18,Other,"{""Other Type"": {""selectedText"": ""Overview of Changes from Previous Policy: We added clarification regarding the use of collected information, consolidated all BWW privacy policies into one, and revised the Policy to comply with California law."", ""startIndexInSegment"": 0, ""endIndexInSegment"": 210, ""value"": ""Other""}}",503,"Overview of Changes from Previous Policy: We added clarification regarding the use of collected information, consolidated all BWW privacy policies into one, and revised the Policy to comply with California law.  "
21797,118,1,Other,"{""Other Type"": {""selectedText"": ""If you are not sure if this privacy policy applies to any webpage directly accessed through Tulsaworld.com, you should click on the privacy policy link at the bottom of the webpage"", ""startIndexInSegment"": 576, ""endIndexInSegment"": 756, ""value"": ""Other""}}",1673,"Welcome to Tulsaworld.com, home of the Tulsa World Online Edition. References in this Privacy Policy to Tulsaworld.com or this ""Website"" include the webpages that are directly accessed through the navigation bars on Tulsaworld.com which have a direct link to this Privacy Policy. There may be some webpages or sections of Tulsaworld.com which are directly accessed through the navigation bar on Tulsaworld.com which are maintained by third parties with whom we have a business relationship. These webpages may link to a separate privacy policy maintained by that third party. If you are not sure if this privacy policy applies to any webpage directly accessed through Tulsaworld.com, you should click on the privacy policy link at the bottom of the webpage, or you may contact Tulsaworld.com as set forth at the end of this policy.  "
21625,118,3,Other,"{""Other Type"": {""selectedText"": ""BY ACCESSING OR USING OUR WEBSITE, YOU ACKNOWLEDGE THAT YOU HAVE READ, UNDERSTAND, AND AGREE TO BE BOUND TO ALL THE TERMS OF THIS PRIVACY POLICY AND OUR WEBSITE TERMS OF USE. IF YOU DO NOT AGREE TO THESE TERMS, EXIT THIS PAGE AD DO NOT ACCESS OR USE THE WEBSITE."", ""startIndexInSegment"": 43, ""endIndexInSegment"": 305, ""value"": ""Other""}}",1673,"PLEASE READ THIS PRIVACY POLICY CAREFULLY. BY ACCESSING OR USING OUR WEBSITE, YOU ACKNOWLEDGE THAT YOU HAVE READ, UNDERSTAND, AND AGREE TO BE BOUND TO ALL THE TERMS OF THIS PRIVACY POLICY AND OUR WEBSITE TERMS OF USE. IF YOU DO NOT AGREE TO THESE TERMS, EXIT THIS PAGE AD DO NOT ACCESS OR USE THE WEBSITE.  "
21785,118,18,Other,"{""Other Type"": {""selectedText"": ""We have no access to or control over these cookies."", ""startIndexInSegment"": 474, ""endIndexInSegment"": 525, ""value"": ""Other""}}",1673,"Some advertisers on Tulsaworld.com may use their own cookies. When you click on an advertisement, visit an advertiser's Web site or make a purchase from an advertiser, that company may use cookies according to their own policies. Advertisers' cookies are not covered under Tulsaworld.com's policy. In addition, we may use third party advertising companies to display advertisements on our Website. As part of their service, they may place separate cookies on your computer. We have no access to or control over these cookies.  "
21806,118,26,Other,"{""Other Type"": {""selectedText"": ""The use of your personally identifiable information by these third parties is governed by the privacy policies of these third parties and is not subject to our control."", ""startIndexInSegment"": 1051, ""endIndexInSegment"": 1219, ""value"": ""Other""}}",1673,"To use third party service providers. We provide some services and products through third parties. These third party service providers may perform functions on our behalf, like sending out and distributing promotional emails. We may share your personally identifiable information with such service providers as necessary to allow those service providers to fulfill orders, send mail or email, administer contests or sweepstakes, remove repetitive information on customer lists, analyze data, provide marketing assistance, provide search results and links, process credit card payments, operate the Website, troubleshoot, or provide customer service. We may also collect personal information from individuals and companies with whom we have business relationships (""Affiliates"") and may share your information with service providers to accomplish our administrative tasks. For example, when you order a service, the third party payment processor we use releases your credit card information to the card-issuing bank to confirm payment for the service. The use of your personally identifiable information by these third parties is governed by the privacy policies of these third parties and is not subject to our control.  "
21738,118,31,Other,"{""Other Type"": {""selectedText"": ""We are not responsible or liable for the actions of such advertiser."", ""startIndexInSegment"": 629, ""endIndexInSegment"": 697, ""value"": ""Other""}}",1673,"Sale transaction information. From time to time, we provide offers from our advertisers who, as part of their offer, request information on customers who purchased their offer in order to allow the advertiser to fulfill the purchase. In those cases, we share some of your personally identifiable information with that advertiser. Sharing this Information may allow that advertiser to market directly to you should it choose to do so. However, we will only share personally identifiable information with an advertiser if you provide us that information and enter into a transaction with that advertiser on or through our Website. We are not responsible or liable for the actions of such advertiser.  "
21770,118,33,Other,"{""Other Type"": {""selectedText"": ""All information you provide directly to Tulsaworld.com is covered under this privacy policy."", ""startIndexInSegment"": 74, ""endIndexInSegment"": 166, ""value"": ""Other""}}",1673,"What information is covered by this privacy policy- What isn't-   All information you provide directly to Tulsaworld.com is covered under this privacy policy. This information may include but is not limited to personally identifiable information such as your name, address, phone number, and e-mail address.  "
21774,118,34,Other,"{""Other Type"": {""selectedText"": ""Information that you might post on a message board, forum, or chat room is not protected under this privacy policy. Information posted in any of these public areas is not considered confidential communication."", ""startIndexInSegment"": 0, ""endIndexInSegment"": 209, ""value"": ""Other""}}",1673,"Information that you might post on a message board, forum, or chat room is not protected under this privacy policy. Information posted in any of these public areas is not considered confidential communication. Tulsaworld.com has the right but not the obligation to monitor the content of its bulletin boards, forums and chat rooms to determine compliance with its policies and terms of use and any other operating rules established for the website. Tulsaworld.com shall have the right in its sole discretion, and without prior notice, to edit, refuse to post, or remove any materials submitted to or posted to its bulletin boards, forums, or chat rooms.  "
21743,118,35,Other,"{""Other Type"": {""selectedText"": ""Tulsaworld.com is not responsible for the disclosure of your information under these circumstances and such disclosure is not covered under this privacy policy."", ""startIndexInSegment"": 339, ""endIndexInSegment"": 499, ""value"": ""Other""}}",1673,"Please keep in mind that whenever you voluntarily disclose information on a public website - for example, on message boards or in chat areas - that information can be collected and used by others. In short, if you post information online that is accessible to the public, you may receive unsolicited messages from other parties in return. Tulsaworld.com is not responsible for the disclosure of your information under these circumstances and such disclosure is not covered under this privacy policy.  "
21766,118,36,Other,"{""Other Type"": {""selectedText"": ""Information collected by vendors or advertisers hosted on Tulsaworld.com or who link to Tulsaworld.com is not covered under this privacy policy. This privacy policy only addresses the use and disclosure of information we collect from you. Other websites that may be accessible through our Website have their own privacy policies and data collection, use and disclosure practices. If you link to any such website, we urge you review the website's privacy policy. We are not responsible for the policies or practices of third parties."", ""startIndexInSegment"": 190, ""endIndexInSegment"": 722, ""value"": ""Other""}}",1673,"Additionally, advertisers and vendors hosted on our site, or who link to our site, may collect information about you if you visit their websites, or purchase products or services from them. Information collected by vendors or advertisers hosted on Tulsaworld.com or who link to Tulsaworld.com is not covered under this privacy policy. This privacy policy only addresses the use and disclosure of information we collect from you. Other websites that may be accessible through our Website have their own privacy policies and data collection, use and disclosure practices. If you link to any such website, we urge you review the website's privacy policy. We are not responsible for the policies or practices of third parties.  "
21744,118,37,Other,"{""Other Type"": {""selectedText"": ""Finally, you are solely responsible for maintaining the secrecy of your passwords and/or any account information. Please be careful and responsible whenever you're online."", ""startIndexInSegment"": 0, ""endIndexInSegment"": 171, ""value"": ""Other""}}",1673,"Finally, you are solely responsible for maintaining the secrecy of your passwords and/or any account information. Please be careful and responsible whenever you're online.  "
21073,95,40,Other,"{""Other Type"": {""selectedText"": ""You may accept certain kinds of contact and decline others. For example, you may choose to accept e-mails, but not postal mail or telephone calls."", ""startIndexInSegment"": 0, ""endIndexInSegment"": 146, ""value"": ""Other""}}",1673,"You may accept certain kinds of contact and decline others. For example, you may choose to accept e-mails, but not postal mail or telephone calls.  "
21761,118,45,Other,"{""Other Type"": {""selectedText"": ""Please refer to the NewsRight News Registry privacy policy at http://www.newsregistry.com/privacycenter/servicepolicy.aspx for further information."", ""startIndexInSegment"": 332, ""endIndexInSegment"": 479, ""value"": ""Other""}}",1673,"Associated Press   We participate in the News Registry, a service operated by the NewsRight, LLC (NewsRight). The News Registry collects content usage information and may use cookies in conjunction with this activity. Your continued readership of the Site means you accept the privacy policy of the NewsRight News Registry. Please refer to the NewsRight News Registry privacy policy at http://www.newsregistry.com/privacycenter/servicepolicy.aspx for further information.  "
21082,95,47,Other,"{""Other Type"": {""selectedText"": ""Refunds Tulsa World will charge a $5 processing fee for refunds remitted to the customer"", ""startIndexInSegment"": 0, ""endIndexInSegment"": 98, ""value"": ""Other""}}",1673,Refunds   Tulsa World will charge a $5 processing fee for refunds remitted to the customer.
8457,95,9,Other,"{""Other Type"": {""endIndexInSegment"": 182, ""startIndexInSegment"": 0, ""selectedText"": ""Forwarding: Forwarding an article found on a MediaNews Web site generally requires that you disclose the name and e-mail address of the person to whom you are forwarding the article."", ""value"": ""Other""}}",1618,Forwarding: Forwarding an article found on a MediaNews Web site generally requires that you disclose the name and e-mail address of the person to whom you are forwarding the article. MediaNews will retain this information only to provide the forwarding services.  
25341,118,12,Other,"{""Other Type"": {""selectedText"": ""Click here to learn more about Yahoo!'s ad practices,"", ""startIndexInSegment"": 908, ""endIndexInSegment"": 961, ""value"": ""Other""}}",1618,"Cookies and Web Beacons: Cookies are used to store and track information about you. A cookie is a small amount of data that is sent to your browser from Web sites and stored on your computer's hard drive. Cookies are used to deliver targeted advertising based on your behavior and demographics and to track your entries in promotions and contests. Cookies may be linked to PIN. In addition, MediaNews uses web beacons provided by third-party advertising companies to help manage our online advertising. Web beacons enable us to recognize a browser's cookie when a browser visits a MediaNews Web site, and to learn which banner ads bring users to MediaNews Web sites. MediaNews websites have two third-party web advertising companies, Yahoo! and DoubleClick, which may place or recognize a unique cookie on your browser. Yahoo! also may use information regarding its own users to select which ads to display. Click here to learn more about Yahoo!'s ad practices, including how to opt out of using anonymous information to select which ads to show you. For more information about DoubleClick, cookies, and how to ""opt-out"", please click here.  "
8522,95,20,Other,"{""Other Type"": {""endIndexInSegment"": 806, ""startIndexInSegment"": 0, ""selectedText"": ""In some cases, MediaNews Group, Inc., MediaNews Group Interactive, Inc. or MediaNews Group affiliates, are affiliates of the CareerBuilder online careers service. Through the cooperative relationship with CareerBuilder, we are able to provide you with access to the CareerBuilder products and services through a co-branded CareerBuilder site. Because of this relationship, CareerBuilder requests that we post the following language regarding our co-branded CareerBuilder site in our privacy policy: \""You may have arrived at this Web site by following a link from a CareerBuilder newspaper affiliate or other affiliate. If so, please be aware that CareerBuilder may share your information with that affiliate and the affiliate may use the information consistent with its privacy policy instead of this one.\"""", ""value"": ""Other""}}",1618,"In some cases, MediaNews Group, Inc., MediaNews Group Interactive, Inc. or MediaNews Group affiliates, are affiliates of the CareerBuilder online careers service. Through the cooperative relationship with CareerBuilder, we are able to provide you with access to the CareerBuilder products and services through a co-branded CareerBuilder site. Because of this relationship, CareerBuilder requests that we post the following language regarding our co-branded CareerBuilder site in our privacy policy: ""You may have arrived at this Web site by following a link from a CareerBuilder newspaper affiliate or other affiliate. If so, please be aware that CareerBuilder may share your information with that affiliate and the affiliate may use the information consistent with its privacy policy instead of this one.""  "
25393,118,20,Other,"{""Other Type"": {""selectedText"": ""In some cases, MediaNews Group, Inc., MediaNews Group Interactive, Inc. or MediaNews Group affiliates, are affiliates of the CareerBuilder online careers service. Through the cooperative relationship with CareerBuilder, we are able to provide you with access to the CareerBuilder products and services through a co-branded CareerBuilder site. Because of this relationship, CareerBuilder requests that we post the following language regarding our co-branded CareerBuilder site in our privacy policy"", ""startIndexInSegment"": 0, ""endIndexInSegment"": 497, ""value"": ""Other""}}",1618,"In some cases, MediaNews Group, Inc., MediaNews Group Interactive, Inc. or MediaNews Group affiliates, are affiliates of the CareerBuilder online careers service. Through the cooperative relationship with CareerBuilder, we are able to provide you with access to the CareerBuilder products and services through a co-branded CareerBuilder site. Because of this relationship, CareerBuilder requests that we post the following language regarding our co-branded CareerBuilder site in our privacy policy: ""You may have arrived at this Web site by following a link from a CareerBuilder newspaper affiliate or other affiliate. If so, please be aware that CareerBuilder may share your information with that affiliate and the affiliate may use the information consistent with its privacy policy instead of this one.""  "
