annotation_ID,annotator_ID,segment_ID,category,attr_val,policy_ID,segment_text
7767,95,20,Other,"{""Other Type"": {""endIndexInSegment"": 153, ""startIndexInSegment"": 0, ""selectedText"": ""Once this privacy policy is created, we will add a link to it on our home page, or as a minimum on the first significant page after entering our website."", ""value"": ""Other""}}",807,"Once this privacy policy is created, we will add a link to it on our home page, or as a minimum on the first significant page after entering our website.  "
23758,123,20,Other,"{""Other Type"": {""endIndexInSegment"": 153, ""startIndexInSegment"": 0, ""selectedText"": ""Once this privacy policy is created, we will add a link to it on our home page, or as a minimum on the first significant page after entering our website."", ""value"": ""Other""}}",807,"Once this privacy policy is created, we will add a link to it on our home page, or as a minimum on the first significant page after entering our website.  "
7768,95,21,Other,"{""Other Type"": {""endIndexInSegment"": 108, ""startIndexInSegment"": 0, ""selectedText"": ""Our Privacy Policy link includes the word 'Privacy', and can be easily be found on the page specified above."", ""value"": ""Other""}}",807,"Our Privacy Policy link includes the word 'Privacy', and can be easily be found on the page specified above.  "
23759,123,21,Other,"{""Other Type"": {""endIndexInSegment"": 108, ""startIndexInSegment"": 0, ""selectedText"": ""Our Privacy Policy link includes the word 'Privacy', and can be easily be found on the page specified above."", ""value"": ""Other""}}",807,"Our Privacy Policy link includes the word 'Privacy', and can be easily be found on the page specified above.  "
7777,95,30,Other,"{""Other Type"": {""endIndexInSegment"": 77, ""startIndexInSegment"": 0, ""selectedText"": ""We will notify the users via email Within 7 business days"", ""value"": ""Other""}}",807,We will notify the users via email     Within 7 business days  
7778,95,31,Other,"{""Other Type"": {""endIndexInSegment"": 92, ""startIndexInSegment"": 0, ""selectedText"": ""We will notify the users via in site notification Within 7 business days"", ""value"": ""Other""}}",807,We will notify the users via in site notification     Within 7 business days  
7779,95,32,Other,"{""Other Type"": {""endIndexInSegment"": 436, ""startIndexInSegment"": 0, ""selectedText"": ""We also agree to the individual redress principle, which requires that individuals have a right to pursue legally enforceable rights against data collectors and processors who fail to adhere to the law. This principle requires not only that individuals have enforceable rights against data users, but also that individuals have recourse to courts or a government agency to investigate and/or prosecute non-compliance by data processors."", ""value"": ""Other""}}",807,"We also agree to the individual redress principle, which requires that individuals have a right to pursue legally enforceable rights against data collectors and processors who fail to adhere to the law. This principle requires not only that individuals have enforceable rights against data users, but also that individuals have recourse to courts or a government agency to investigate and/or prosecute non-compliance by data processors.  "
10317,103,7,Other,"{""Other Type"": {""endIndexInSegment"": 54, ""startIndexInSegment"": 0, ""selectedText"": ""This privacy policy was last updated on July 10, 2014."", ""value"": ""Other""}}",1205,"This privacy policy was last updated on July 10, 2014."
14150,123,7,Other,"{""Other Type"": {""endIndexInSegment"": 370, ""startIndexInSegment"": 9, ""selectedText"": ""Links to Other Websites The IFSA-Butler website contains links to other websites that may or may not be affiliated with the Institute for Study Abroad, Butler University. IFSA-Butler is not responsible for the content or privacy practices on these websites, nor does the posting of a link constitute an endorsement by IFSA-Butler of said website."", ""value"": ""Other""}}",541," Links to Other Websites   The IFSA-Butler website contains links to other websites that may or may not be affiliated with the Institute for Study Abroad, Butler University. IFSA-Butler is not responsible for the content or privacy practices on these websites, nor does the posting of a link constitute an endorsement by IFSA-Butler of said website.  "
14157,123,12,Other,"{""Other Type"": {""endIndexInSegment"": 281, ""startIndexInSegment"": 0, ""selectedText"": ""All textual, graphic and other content appearing on this website are the property of the Institute for Study Abroad, Butler University (IFSA-Butler). Copyright 2004-2010. Institute for Study Abroad, 1100 W. 42nd St., Suite 305, Indianapolis, Indiana 46208 USA. All Rights Reserved."", ""value"": ""Other""}}",541,"All textual, graphic and other content appearing on this website are the property of the Institute for Study Abroad, Butler University (IFSA-Butler). Copyright 2004-2010. Institute for Study Abroad, 1100 W. 42nd St., Suite 305, Indianapolis, Indiana 46208 USA. All Rights Reserved.  "
11057,118,10,Other,"{""Other Type"": {""endIndexInSegment"": 288, ""startIndexInSegment"": 55, ""selectedText"": ""Liquor.com may create links allowing you to access third party sites. Liquor.com is not responsible for the content that appears on those sites and does not endorse these sites. Please consult those sites' individual privacy policies"", ""value"": ""Other""}}",59,"LINKS TO OTHER SITES   As part of the service, Liquor.com may create links allowing you to access third party sites. Liquor.com is not responsible for the content that appears on those sites and does not endorse these sites. Please consult those sites' individual privacy policies in order to determine how they treat user information.  "
14072,118,0,Other,"{""Other Type"": {""endIndexInSegment"": 94, ""startIndexInSegment"": 0, ""selectedText"": ""Internet Brands Privacy Highlights Privacy Policy Cookie Policy Privacy Contact"", ""value"": ""Other""}}",940,Internet Brands Privacy Highlights  Privacy Policy  Cookie Policy  Privacy Contact 
14076,118,2,Other,"{""Other Type"": {""endIndexInSegment"": 275, ""startIndexInSegment"": 0, ""selectedText"": ""This privacy policy applies to our sites and services on which we display or post a direct link to this privacy policy. This privacy policy does not apply to those sites and services that do not display or link to this privacy policy, or that have their own privacy policies."", ""value"": ""Other""}}",940,"This privacy policy applies to our sites and services on which we display or post a direct link to this privacy policy. This privacy policy does not apply to those sites and services that do not display or link to this privacy policy, or that have their own privacy policies. However, we often acquire new companies to expand our business. Some acquired companies may operate under their own privacy policies until we integrate their privacy practices with ours.  "
14317,116,17,Other,"{""Other Type"": {""endIndexInSegment"": 140, ""startIndexInSegment"": 9, ""selectedText"": ""How We Use Personal Information We may use information collected from you in one or more of the following ways:"", ""value"": ""Other""}}",940, How We Use Personal Information    We may use information collected from you in one or more of the following ways:  
15446,118,37,Other,"{""Other Type"": {""selectedText"": ""We may engage third parties to perform services on our behalf, including maintenance services, hosting, data storage, security, analytics and data analysis, payment processing, assisting in marketing efforts, email and text message distribution, customer service, providing certain interactive tools, and conducting surveys and sweepstakes."", ""startIndexInSegment"": 0, ""endIndexInSegment"": 340, ""value"": ""Other""}}",940,"We may engage third parties to perform services on our behalf, including maintenance services, hosting, data storage, security, analytics and data analysis, payment processing, assisting in marketing efforts, email and text message distribution, customer service, providing certain interactive tools, and conducting surveys and sweepstakes. "
14378,116,52,Other,"{""Other Type"": {""endIndexInSegment"": 681, ""startIndexInSegment"": 440, ""selectedText"": ""For more, information, please read our Cookie Policy. By visiting our sites and services, you consent to the placement of cookies and beacons in your browser and HTML-based emails in accordance with this privacy policy and our Cookie Policy."", ""value"": ""Other""}}",940," Cookies    We use use cookies and other tracking technologies (including browser cookies, pixels, beacons, mobile application identifiers, and Adobe Flash technology) to help us recognize you across different sites and services, improve your experience, increase security, measure use and effectiveness of our services, and serve advertising. You can control cookies through your browser settings and other tools. For more, information, please read our Cookie Policy. By visiting our sites and services, you consent to the placement of cookies and beacons in your browser and HTML-based emails in accordance with this privacy policy and our Cookie Policy.  "
15472,118,52,Other,"{""Other Type"": {""selectedText"": ""or more, information, please read our Cookie Policy."", ""startIndexInSegment"": 441, ""endIndexInSegment"": 493, ""value"": ""Other""}}",940," Cookies    We use use cookies and other tracking technologies (including browser cookies, pixels, beacons, mobile application identifiers, and Adobe Flash technology) to help us recognize you across different sites and services, improve your experience, increase security, measure use and effectiveness of our services, and serve advertising. You can control cookies through your browser settings and other tools. For more, information, please read our Cookie Policy. By visiting our sites and services, you consent to the placement of cookies and beacons in your browser and HTML-based emails in accordance with this privacy policy and our Cookie Policy.  "
14381,116,54,Other,"{""Other Type"": {""endIndexInSegment"": 907, ""startIndexInSegment"": 487, ""selectedText"": ""Be aware, information that you voluntarily disclose in any of these areas of our sites or services is unencrypted, public information and, therefore, there can be no expectation of privacy or confidentiality, except if the terms and conditions of the site or service specifically limit use of the content (for example, we may let you know how such survey and rating responses will be used and if anonymity is an option)."", ""value"": ""Other""}}",940," User Generated Content, Online Communities and Forums, Profiles and Reviews    You may choose to publicly disclose personal information about yourself and others in the course of (i) contributing user generated content (for instance articles, blogs, surveys, reviews, ratings, or podcasts), (ii) communicating with others in our online forums, communities, or chat rooms, (iii) creating user profiles for public view, or (iv) posting images, photos, or videos. Be aware, information that you voluntarily disclose in any of these areas of our sites or services is unencrypted, public information and, therefore, there can be no expectation of privacy or confidentiality, except if the terms and conditions of the site or service specifically limit use of the content (for example, we may let you know how such survey and rating responses will be used and if anonymity is an option).  "
15475,118,54,Other,"{""Other Type"": {""selectedText"": ""Be aware, information that you voluntarily disclose in any of these areas of our sites or services is unencrypted, public information and, therefore, there can be no expectation of privacy or confidentiality, except if the terms and conditions of the site or service specifically limit use of the content (for example, we may let you know how such survey and rating responses will be used and if anonymity is an option)."", ""startIndexInSegment"": 487, ""endIndexInSegment"": 907, ""value"": ""Other""}}",940," User Generated Content, Online Communities and Forums, Profiles and Reviews    You may choose to publicly disclose personal information about yourself and others in the course of (i) contributing user generated content (for instance articles, blogs, surveys, reviews, ratings, or podcasts), (ii) communicating with others in our online forums, communities, or chat rooms, (iii) creating user profiles for public view, or (iv) posting images, photos, or videos. Be aware, information that you voluntarily disclose in any of these areas of our sites or services is unencrypted, public information and, therefore, there can be no expectation of privacy or confidentiality, except if the terms and conditions of the site or service specifically limit use of the content (for example, we may let you know how such survey and rating responses will be used and if anonymity is an option).  "
14383,116,55,Other,"{""Other Type"": {""endIndexInSegment"": 520, ""startIndexInSegment"": 140, ""selectedText"": ""Prior to posting in these areas, we encourage you to read the specific site's or service's terms of use, as we are not responsible for the personal information you choose to make public in any of these areas and strongly recommend against sharing any personal health or other sensitive information that could directly or indirectly be traced to any individual, including yourself."", ""value"": ""Other""}}",940,"Any personal information you submit in the course of interacting in these public activities can be read, collected, or used by other users. Prior to posting in these areas, we encourage you to read the specific site's or service's terms of use, as we are not responsible for the personal information you choose to make public in any of these areas and strongly recommend against sharing any personal health or other sensitive information that could directly or indirectly be traced to any individual, including yourself.  "
15477,118,55,Other,"{""Other Type"": {""selectedText"": ""Prior to posting in these areas, we encourage you to read the specific site's or service's terms of use, as we are not responsible for the personal information you choose to make public in any of these areas and strongly recommend against sharing any personal health or other sensitive information that could directly or indirectly be traced to any individual, including yourself."", ""startIndexInSegment"": 140, ""endIndexInSegment"": 520, ""value"": ""Other""}}",940,"Any personal information you submit in the course of interacting in these public activities can be read, collected, or used by other users. Prior to posting in these areas, we encourage you to read the specific site's or service's terms of use, as we are not responsible for the personal information you choose to make public in any of these areas and strongly recommend against sharing any personal health or other sensitive information that could directly or indirectly be traced to any individual, including yourself.  "
15479,118,56,Other,"{""Other Type"": {""selectedText"": ""The methods for accessing your personal information will depend on which sites or services you use and their features."", ""startIndexInSegment"": 378, ""endIndexInSegment"": 496, ""value"": ""Other""}}",940," Accessing and Updating Personal Information    We encourage you to keep your personal information updated and accurate. We provide you reasonable access to your personal information and the ability to review, correct, or delete it. For instance, some of our sites and services give you the ability to view and/or edit your personal information online. The methods for accessing your personal information will depend on which sites or services you use and their features. You have several choices; for instance:  "
15056,121,57,Other,"{""Other Type"": {""selectedText"": ""To view and change the personal information that you directly provided to us, you can return to the web page on our site where you originally submitted the data and follow the instructions on that web page."", ""startIndexInSegment"": 0, ""endIndexInSegment"": 206, ""value"": ""Other""}}",940,"To view and change the personal information that you directly provided to us, you can return to the web page on our site where you originally submitted the data and follow the instructions on that web page. "
15065,121,64,Other,"{""Other Type"": {""selectedText"": ""If you have additional questions about your options, contact us."", ""startIndexInSegment"": 0, ""endIndexInSegment"": 64, ""value"": ""Other""}}",940,"If you have additional questions about your options, contact us. "
14640,118,64,Other,"{""Other Type"": {""selectedText"": ""If you have additional questions about your options, contact us."", ""startIndexInSegment"": 0, ""endIndexInSegment"": 64, ""value"": ""Other""}}",940,"If you have additional questions about your options, contact us. "
15083,121,66,Other,"{""Other Type"": {""selectedText"": ""If you have posted comments or user generated content on our site, we may not be able to delete it. Further, we take no responsibility for removing or editing any of your public activities or any submissions or content that is a result of your public activities, except as provided in this privacy policy or the sites. or services' terms of use."", ""startIndexInSegment"": 234, ""endIndexInSegment"": 584, ""value"": ""Other""}}",940,"Please be aware that certain records and information will be retained for specific purposes such as legal, payment, accounting, technical, dispute resolution, enforcement of our sites. and services' terms of use, or customer service. If you have posted comments or user generated content on our site, we may not be able to delete it. Further, we take no responsibility for removing or editing any of your public activities or any submissions or content that is a result of your public activities, except as provided in this privacy policy or the sites. or services' terms of use.  "
15485,118,66,Other,"{""Other Type"": {""selectedText"": ""Further, we take no responsibility for removing or editing any of your public activities or any submissions or content that is a result of your public activities, except as provided in this privacy policy or the sites. or services' terms of use."", ""startIndexInSegment"": 334, ""endIndexInSegment"": 579, ""value"": ""Other""}}",940,"Please be aware that certain records and information will be retained for specific purposes such as legal, payment, accounting, technical, dispute resolution, enforcement of our sites. and services' terms of use, or customer service. If you have posted comments or user generated content on our site, we may not be able to delete it. Further, we take no responsibility for removing or editing any of your public activities or any submissions or content that is a result of your public activities, except as provided in this privacy policy or the sites. or services' terms of use.  "
15086,121,69,Other,"{""Other Type"": {""selectedText"": ""Our sites and services may allow us or other users to communicate with you or other users through our in-product instant messaging services, service-branded emails, SMS and other electronic communication channels."", ""startIndexInSegment"": 55, ""endIndexInSegment"": 273, ""value"": ""Other""}}",940," Email and Other Communications    Our sites and services may allow us or other users to communicate with you or other users through our in-product instant messaging services, service-branded emails, SMS and other electronic communication channels.  "
14405,116,69,Other,"{""Other Type"": {""endIndexInSegment"": 273, ""startIndexInSegment"": 9, ""selectedText"": ""Email and Other Communications Our sites and services may allow us or other users to communicate with you or other users through our in-product instant messaging services, service-branded emails, SMS and other electronic communication channels."", ""value"": ""Other""}}",940," Email and Other Communications    Our sites and services may allow us or other users to communicate with you or other users through our in-product instant messaging services, service-branded emails, SMS and other electronic communication channels.  "
15486,118,69,Other,"{""Other Type"": {""selectedText"": ""Our sites and services may allow us or other users to communicate with you or other users through our in-product instant messaging services, service-branded emails, SMS and other electronic communication channels."", ""startIndexInSegment"": 60, ""endIndexInSegment"": 273, ""value"": ""Other""}}",940," Email and Other Communications    Our sites and services may allow us or other users to communicate with you or other users through our in-product instant messaging services, service-branded emails, SMS and other electronic communication channels.  "
14406,116,70,Other,"{""Other Type"": {""endIndexInSegment"": 227, ""startIndexInSegment"": 68, ""selectedText"": ""Requested communications include, for instance, email newsletters or software updates that may be expressly requested by you or which you consented to receive."", ""value"": ""Other""}}",940," Opting Out of Requested Communications    Requested communications include, for instance, email newsletters or software updates that may be expressly requested by you or which you consented to receive. After you request such communications, you may ""opt out"" of receiving them by using one of the following methods:   Select the email ""opt out"" or ""unsubscribe"" link, or follow the opt-out instructions included in each email communication.  To unsubscribe from text messages delivered to mobile devices, reply to the message with the words ""STOP"" or ""END.""  Return to the web page(s) where you originally registered your preferences and follow the opt-out instructions.  Contact us. Please provide your name, contact information, and specific relevant information that you no longer wish to receive. "
15090,121,71,Other,"{""Other Type"": {""selectedText"": ""Communications that are sent by or on behalf of a user are indicated as being \""From\"" that user. Communications that are sent by us are indicated as being from us or one of our account or support specialists assigned to assist you. Either type of communication may be \""real time\"" communications or communications triggered automatically upon the occurrence of certain events or dates, such as appointment reminders. Email communications received from users and our administrative announcements are often transactional or relationship messages, such as appointment requests, reminders and cancellations. You may not be able to opt out of receiving certain messages although our services may provide a means to modify the frequency of receiving them."", ""startIndexInSegment"": 69, ""endIndexInSegment"": 816, ""value"": ""Other""}}",940,"Opting Out of Transactional or Relationship Communications   Communications that are sent by or on behalf of a user are indicated as being ""From"" that user. Communications that are sent by us are indicated as being from us or one of our account or support specialists assigned to assist you. Either type of communication may be ""real time"" communications or communications triggered automatically upon the occurrence of certain events or dates, such as appointment reminders. Email communications received from users and our administrative announcements are often transactional or relationship messages, such as appointment requests, reminders and cancellations. You may not be able to opt out of receiving certain messages although our services may provide a means to modify the frequency of receiving them.  "
14411,116,71,Other,"{""Other Type"": {""endIndexInSegment"": 670, ""startIndexInSegment"": 69, ""selectedText"": ""Communications that are sent by or on behalf of a user are indicated as being \""From\"" that user. Communications that are sent by us are indicated as being from us or one of our account or support specialists assigned to assist you. Either type of communication may be \""real time\"" communications or communications triggered automatically upon the occurrence of certain events or dates, such as appointment reminders. Email communications received from users and our administrative announcements are often transactional or relationship messages, such as appointment requests, reminders and cancellations."", ""value"": ""Other""}}",940,"Opting Out of Transactional or Relationship Communications   Communications that are sent by or on behalf of a user are indicated as being ""From"" that user. Communications that are sent by us are indicated as being from us or one of our account or support specialists assigned to assist you. Either type of communication may be ""real time"" communications or communications triggered automatically upon the occurrence of certain events or dates, such as appointment reminders. Email communications received from users and our administrative announcements are often transactional or relationship messages, such as appointment requests, reminders and cancellations. You may not be able to opt out of receiving certain messages although our services may provide a means to modify the frequency of receiving them.  "
