annotation_ID,annotator_ID,segment_ID,category,attr_val,policy_ID,segment_text
9994,118,7,Other,"{""Other Type"": {""endIndexInSegment"": 30, ""startIndexInSegment"": 0, ""selectedText"": ""Your California Privacy Rights"", ""value"": ""Other""}}",1510,"Your California Privacy Rights   Effective January 1, 2005, California Civil Code Section 1798.83 (known as the ""Shine the Light"" law) provides that, if an individual who is a California resident has provided his/her personal information to a business in connection with a business relationship that is primarily for personal, family, or household purposes, and if that business has within the immediately preceding calendar year disclosed such individual's personal information to a third party and knows or should have known that such third party used the information for its own direct marketing purposes, then that business is obligated to disclose in writing to such individual upon request, what personal information was shared and with whom the information was shared. A business may comply with this law by: (1) having EITHER a published privacy policy of not sharing a customer's personal information for third-party direct marketing use unless the customer has first affirmatively opted in to such sharing OR a published privacy policy of not sharing a customer's personal information for third-party direct marketing use if the customer has opted out to prevent his/her personal information from being shared for third-party direct marketing use; AND (2) notifying the customer of his/her right to opt out and providing a cost-free means for the customer to exercise that right.  "
9998,118,8,Other,"{""Other Type"": {""endIndexInSegment"": -1, ""startIndexInSegment"": -1, ""value"": ""Other""}}",1510,"California residents may request an information-sharing disclosure from us by emailing your request to support@JibJab.com or writing to us at JibJab Bros. Studios, Att: Privacy Dept., 13428 Maxella Ave 363, Marina Del Rey, CA 90292. Please note that, under the law, we are not required to respond to your request more than once in a calendar year, nor are we required to respond to any requests that are not sent to the above-designated email or mailing address.  "
11220,116,14,Other,"{""Other Type"": {""endIndexInSegment"": 200, ""startIndexInSegment"": 0, ""selectedText"": ""From time to time, JibJab and one or more of its partners may co-sponsor a promotion, sweepstake or contest or may offer a co-branded product or service on the JibJab Sites (each, a \""Joint Offering\"")."", ""value"": ""Other""}}",1510,"From time to time, JibJab and one or more of its partners may co-sponsor a promotion, sweepstake or contest or may offer a co-branded product or service on the JibJab Sites (each, a ""Joint Offering""). Users may be asked to provide personal information such as name, email address, home address, etc. or to answer questions in order to participate in a Joint Offering, which personal information may be shared by JibJab with its partners involved in such Joint Offering, and such partners may use the information for its own advertising and marketing purposes. Also, we may transfer personal information to certain ad partners that you have explicitly requested to receive information from. It will be clear at the point of collection who is collecting the personal information and whose privacy statement will apply.  "
10419,118,14,Other,"{""Other Type"": {""endIndexInSegment"": 816, ""startIndexInSegment"": 690, ""selectedText"": ""It will be clear at the point of collection who is collecting the personal information and whose privacy statement will apply."", ""value"": ""Other""}}",1510,"From time to time, JibJab and one or more of its partners may co-sponsor a promotion, sweepstake or contest or may offer a co-branded product or service on the JibJab Sites (each, a ""Joint Offering""). Users may be asked to provide personal information such as name, email address, home address, etc. or to answer questions in order to participate in a Joint Offering, which personal information may be shared by JibJab with its partners involved in such Joint Offering, and such partners may use the information for its own advertising and marketing purposes. Also, we may transfer personal information to certain ad partners that you have explicitly requested to receive information from. It will be clear at the point of collection who is collecting the personal information and whose privacy statement will apply.  "
11238,116,15,Other,"{""Other Type"": {""endIndexInSegment"": 1072, ""startIndexInSegment"": 917, ""selectedText"": ""For more information about Flash cookies and how to remove them from your computer, please see the paragraph below entitled \""SPECIAL NOTE - Flash Cookies.\"""", ""value"": ""Other""}}",1510,"Use of Cookies Similar Tracking Technologies   A ""cookie"" is a small amount of data that is sent to your browser from an Internet server and stored in your computer. JibJab uses cookies (including Flash cookies) to store user preferences, account status, traffic origination, and to record session information, for purposes including ensuring that users are not repeatedly offered the same advertisements and to customize newsletter, advertising, and Web page content based on browser type and user profile information. You may be able to configure your browser to accept or reject all or some cookies (other than Flash cookies), or notify you when a cookie (other than a Flash cookie) is set - each browser is different, so check the ""Help"" menu of your browser to learn how to change your cookie preferences - however, you must enable cookies from JibJab in order to use most functions on the JibJab Sites. For more information about Flash cookies and how to remove them from your computer, please see the paragraph below entitled ""SPECIAL NOTE - Flash Cookies.""  "
10440,118,15,Other,"{""Other Type"": {""endIndexInSegment"": 1072, ""startIndexInSegment"": 917, ""selectedText"": ""For more information about Flash cookies and how to remove them from your computer, please see the paragraph below entitled \""SPECIAL NOTE - Flash Cookies.\"""", ""value"": ""Other""}}",1510,"Use of Cookies Similar Tracking Technologies   A ""cookie"" is a small amount of data that is sent to your browser from an Internet server and stored in your computer. JibJab uses cookies (including Flash cookies) to store user preferences, account status, traffic origination, and to record session information, for purposes including ensuring that users are not repeatedly offered the same advertisements and to customize newsletter, advertising, and Web page content based on browser type and user profile information. You may be able to configure your browser to accept or reject all or some cookies (other than Flash cookies), or notify you when a cookie (other than a Flash cookie) is set - each browser is different, so check the ""Help"" menu of your browser to learn how to change your cookie preferences - however, you must enable cookies from JibJab in order to use most functions on the JibJab Sites. For more information about Flash cookies and how to remove them from your computer, please see the paragraph below entitled ""SPECIAL NOTE - Flash Cookies.""  "
10467,118,26,Other,"{""Other Type"": {""endIndexInSegment"": 270, ""startIndexInSegment"": 198, ""selectedText"": ""Please note that the email must come from the account you wish to block."", ""value"": ""Other""}}",1510,You may prevent JibJab messages from being sent to any email address you control by sending an email request to support@jibjab.com or by visiting and adjusting your email preferences in My Account. Please note that the email must come from the account you wish to block.  
10523,118,30,Other,"{""Other Type"": {""endIndexInSegment"": 454, ""startIndexInSegment"": 223, ""selectedText"": ""When you leave a JibJab Site and go to a third-party site, our Privacy Policy will no longer apply, and any information collected from or about you on the third-party site will be governed by the privacy policy of that third party."", ""value"": ""Other""}}",1510,"Third-Party Sites   The JibJab Sites contain links to third-party sites. Unless expressly otherwise stated by JibJab, JibJab is not responsible for the privacy policies and/or practices of linked third-party sites. When you leave a JibJab Site and go to a third-party site, our Privacy Policy will no longer apply, and any information collected from or about you on the third-party site will be governed by the privacy policy of that third party. Third-party sites' privacy policies and data practices may be substantially different from those of JibJab. They may send their own cookies, web beacons, etc. to your computer or mobile device, and may collect data about you and make use of the data in ways that we would not. You access such third-party sites entirely at your own risk. You should always read the privacy policy of a third-party site before disclosing any personal information on that site.  "
10526,118,31,Other,"{""Other Type"": {""endIndexInSegment"": 642, ""startIndexInSegment"": 449, ""selectedText"": ""any personal information you submit to the third-party app store in connection with the purchase is subject to and governed by the privacy policy of the third-party app store, and not JibJab's."", ""value"": ""Other""}}",1510,"For example, some of the JibJab Sites allow you to check out through Paypal. If you choose to use Paypal, your use of the Paypal service (including any personal information you submit to Paypal) is subject to and governed by Paypal's privacy policy, and not JibJab's. Also, when you purchase a JibJab mobile app from a third-party app store (e.g., Apple/iTunes), your purchase is with the third-party app store and not with JibJab, and accordingly, any personal information you submit to the third-party app store in connection with the purchase is subject to and governed by the privacy policy of the third-party app store, and not JibJab's.  "
10462,118,32,Other,"{""Other Type"": {""endIndexInSegment"": 352, ""startIndexInSegment"": 248, ""selectedText"": ""We are not responsible for the personally identifiable information you choose to submit in these forums."", ""value"": ""Other""}}",1510,Public Communication   Please be aware that whenever you voluntarily post information on the JibJab Site(s) that that information can be accessed by the public and can in turn be used by those people to send you unsolicited communications. We are not responsible for the personally identifiable information you choose to submit in these forums.  
24902,118,14,Other,"{""Other Type"": {""selectedText"": ""For more information click here"", ""startIndexInSegment"": 86, ""endIndexInSegment"": 117, ""value"": ""Other""}}",58,g. Tracking Requests. Hearst does not act on Do Not Track requests from your browser. For more information click here  
8252,95,18,Other,"{""Other Type"": {""endIndexInSegment"": 1244, ""startIndexInSegment"": 0, ""selectedText"": ""c. When you provide us your email address(e.g., to subscribe to our Magazines) but are not already a registered user of one of our Covered Sites, some of our Covered Sites may assign you a user name and password so that we can enhance your user experience by facilitating easy entry into other features and offers on the Covered Sites and saving your preferences. Certain areas on our Covered Sites require registration, and in those areas, you will be asked to establish your own user name and password or you can elect to use the one we've assigned. Your user name and password (\""User Registration\"") will function across many of our Covered Sites, regardless of brand. Your User Registration will also be recognized at some of our Affiliate sites and sites which we partner with so that you may easily access features on those sites using your User Registration (\""Shared Registration Sites\""); however the information we provide and your actions on those Shared Registration Sites will be governed by the separate privacy policies of those Shared Registration Sites. A list of those Shared Registration Sites is set forth below, and may be updated from time to time. Current SharedRegistration Sites are: The National Magazine Company Limited."", ""value"": ""Other""}}",58,"c. When you provide us your email address(e.g., to subscribe to our Magazines) but are not already a registered user of one of our Covered Sites, some of our Covered Sites may assign you a user name and password so that we can enhance your user experience by facilitating easy entry into other features and offers on the Covered Sites and saving your preferences. Certain areas on our Covered Sites require registration, and in those areas, you will be asked to establish your own user name and password or you can elect to use the one we've assigned. Your user name and password (""User Registration"") will function across many of our Covered Sites, regardless of brand. Your User Registration will also be recognized at some of our Affiliate sites and sites which we partner with so that you may easily access features on those sites using your User Registration (""Shared Registration Sites""); however the information we provide and your actions on those Shared Registration Sites will be governed by the separate privacy policies of those Shared Registration Sites. A list of those Shared Registration Sites is set forth below, and may be updated from time to time. Current SharedRegistration Sites are: The National Magazine Company Limited. You may elect to change your UserRegistration at any time by logging in and editing your User Registration (each of our Covered Sites will contain log-in information). You may also log-in to cancel any User Registration that you may have selected or that we may have assigned. If you cancel your User Registration, we will retain your email address, user name and assigned user ID on file and use them only for thepurpose of assuring you are not automatically registered again, against your wishes. You may request deletion of your Personally Identifiable Information by us, but please note that we may be required to keep this information and not delete it (or to keep this information for a certain time, in which case we will comply with your deletion request only after we have fulfilled such requirements). When we delete any information, it will be deleted from the active database, but may remain in our archives. We may retain your information for fraud or similar purposes.  "
8259,95,19,Other,"{""Other Type"": {""endIndexInSegment"": 602, ""startIndexInSegment"": 286, ""selectedText"": ""If you provide us with personal anecdotes,they may be attributed to you. Hearst can edit, rewrite, use, and reuse the content, including your name, likeness,photograph, and biographical information you provide, with or without attribution, including publication in the Magazines, and in trade media, and advertising."", ""value"": ""Other""}}",58,"d. In addition, we may use information you provide us through emails, QA, blogs, forums, in response to polls, or through any other user generated submission for editorial purposes, and may use your name and any stories you provide us in articles published online and in our Magazines. If you provide us with personal anecdotes,they may be attributed to you. Hearst can edit, rewrite, use, and reuse the content, including your name, likeness,photograph, and biographical information you provide, with or without attribution, including publication in the Magazines, and in trade media, and advertising.  "
25019,118,36,Other,"{""Other Type"": {""selectedText"": ""For the avoidance of doubt, these opt-out options are available for all users and are not limited to Californian and Canadian users."", ""startIndexInSegment"": 1614, ""endIndexInSegment"": 1746, ""value"": ""Other""}}",58,"5. Right to Opt-out   a. California Canadian Users: Your California Privacy Rights. California's ""Shine the Light"" law, Civil Code section 1798.83, requires certain businesses to respond to requests from California customers asking about the businesses' practices related to disclosing personal information to third parties for the third parties' direct marketing purposes. Alternatively, such businesses may have in place a policy not to disclose personal information of customers to third parties for the third parties' direct marketing purposes if the customer has exercised an option to opt-out of such information sharing. We have such a policy in place. Sections 4(d)and 5(d) explain our practices and how you can opt-out of having your information shared with third parties for the third parties' direct or indirect marketing purposes, in accordance with such laws. In addition to reviewing Sections 4(d) and5(d), if you wish to find out about any rights you may have under California Civil Code section 1798.83, you may notify us in writing at Mail Preference Service,P.O. Box 6000, Harlan, Iowa 51593 or contacting us at customercare@hearstmags.com. In the case of marketing via Paid Video SubscriptionServices, please refer to the customer service contact set forth at section4(e) above. Canadian residents also have certain rights to know how their information may be shared with third parties who engage in direct marketing activities. Again, Sections 4(d)and 5(d) explain our practices and how you can opt-out of having your information shared for such purposes, in accordance with such laws. For the avoidance of doubt, these opt-out options are available for all users and are not limited to Californian and Canadian users.  "
24921,118,38,Other,"{""Other Type"": {""selectedText"": ""https://preferences.hearstmags.com/Hearst/Login.aspx"", ""startIndexInSegment"": 290, ""endIndexInSegment"": 342, ""value"": ""Other""}}",58,"c. Marketing provided by Hearst. From time to time we may send you promotional materials on behalf of Hearst and/or third parties. If you want us to stop sending you promotional materials to your email, you may follow the unsubscribe instructions in the email or manage your preferences at https://preferences.hearstmags.com/Hearst/Login.aspx. If you want us to stop sending you promotional materials to your postal mailing address, you may notify us in writing by sending a notice to Mail PreferenceService, P.O. Box 6000, Harlan, Iowa 51593 or contacting us at customercare@hearstmags.com. Certain Covered Sites may include a customer service link at the bottom of such site. If so, you may also manage your email preferences through that link.  "
8295,95,40,Other,"{""Other Type"": {""endIndexInSegment"": 643, ""startIndexInSegment"": 0, ""selectedText"": ""e. Exceptions. If you have opted-out as described above, and thereafter you elect to use a service or promotion that requires us to contact you or share your information with a third party (e.g.,you enter into a contest or sweepstakes or use an ecommerce service after opting-out), then your previous opt-out preferences will not apply to such service. Despite your indicated preferences, we may send you service related communications, including notices about your subscription, and we may continue disclosing your information to third parties under the Service Provider Exception, Legal Exceptions, and Acquisition Exception described above."", ""value"": ""Other""}}",58,"e. Exceptions. If you have opted-out as described above, and thereafter you elect to use a service or promotion that requires us to contact you or share your information with a third party (e.g.,you enter into a contest or sweepstakes or use an ecommerce service after opting-out), then your previous opt-out preferences will not apply to such service. Despite your indicated preferences, we may send you service related communications, including notices about your subscription, and we may continue disclosing your information to third parties under the Service Provider Exception, Legal Exceptions, and Acquisition Exception described above.  "
25042,118,42,Other,"{""Other Type"": {""selectedText"": ""To use the wireless email address, SMS, WAP, or Mobile Service, you must reside in theUnited States."", ""startIndexInSegment"": 672, ""endIndexInSegment"": 772, ""value"": ""Other""}}",58,"6. Wireless Email Address, Short MessageServices and WAP. If the email address you provide to us isa wireless email address, you agree to receive messages at such address from Hearst or from third parties. Similarly,we may make available services through which you can receive messages on your phone or wireless device SMS Service or WAP Services. We may also make available content and versions of our Covered Sites available via WAP and Mobile Services. If you subscribe to one of our SMS, WAP or Mobile Services, you thereby agree to receive services and messages at the address you provide for such purposes. Such messages may come from Hearst, or from third parties. To use the wireless email address, SMS, WAP, or Mobile Service, you must reside in theUnited States. We may also obtain the date, time and content of your messages. We will use the information we obtain in connection with these services in accordance with this Privacy Policy. Your wireless carrier and other service providers may also collect data about your wireless device usage, and their practices are governed by their own policies. By providing us your wireless email address or by signing up for any SMS, WAP, or Mobile Service, you consent to receiving messages as described above. You understand that your wireless carrier's standard rates apply to these messages. You represent that you are the owner or authorized user of the wireless device on which messages will be received, and that you are authorized to approve the applicable charges.  "
13156,121,0,Other,"{""Other Type"": {""endIndexInSegment"": 14, ""startIndexInSegment"": 0, ""selectedText"": ""Privacy Policy"", ""value"": ""Other""}}",745,Privacy Policy  
13158,121,2,Other,"{""Other Type"": {""endIndexInSegment"": 293, ""startIndexInSegment"": 9, ""selectedText"": ""Disclaimer The information provided is \""as is\"" with all faults and without warranty of any kind, expressed or implied. National Chicken Council (NCC) makes no warranties or representations regarding the accuracy or completeness of the information contained herein."", ""value"": ""Other""}}",745," Disclaimer    The information provided is ""as is"" with all faults and without warranty of any kind, expressed or implied. National Chicken Council (NCC) makes no warranties or representations regarding the accuracy or completeness of the information contained herein.  "
13159,121,3,Other,"{""Other Type"": {""endIndexInSegment"": 310, ""startIndexInSegment"": 0, ""selectedText"": ""NCC has provided links to other Internet sites only for the convenience of World-Wide Web users, and is not responsible for the materials, activities or content of other sites. NCC does not endorse, warrant or guarantee any products or services described or offered at these companies, addresses, or Web sites."", ""value"": ""Other""}}",745,"NCC has provided links to other Internet sites only for the convenience of World-Wide Web users, and is not responsible for the materials, activities or content of other sites. NCC does not endorse, warrant or guarantee any products or services described or offered at these companies, addresses, or Web sites."
11715,116,3,Other,"{""Other Type"": {""endIndexInSegment"": 310, ""startIndexInSegment"": 0, ""selectedText"": ""NCC has provided links to other Internet sites only for the convenience of World-Wide Web users, and is not responsible for the materials, activities or content of other sites. NCC does not endorse, warrant or guarantee any products or services described or offered at these companies, addresses, or Web sites."", ""value"": ""Other""}}",745,"NCC has provided links to other Internet sites only for the convenience of World-Wide Web users, and is not responsible for the materials, activities or content of other sites. NCC does not endorse, warrant or guarantee any products or services described or offered at these companies, addresses, or Web sites."
11990,118,3,Other,"{""Other Type"": {""endIndexInSegment"": 310, ""startIndexInSegment"": 0, ""selectedText"": ""NCC has provided links to other Internet sites only for the convenience of World-Wide Web users, and is not responsible for the materials, activities or content of other sites. NCC does not endorse, warrant or guarantee any products or services described or offered at these companies, addresses, or Web sites."", ""value"": ""Other""}}",745,"NCC has provided links to other Internet sites only for the convenience of World-Wide Web users, and is not responsible for the materials, activities or content of other sites. NCC does not endorse, warrant or guarantee any products or services described or offered at these companies, addresses, or Web sites."
6251,88,25,Other,"{""Other Type"": {""endIndexInSegment"": 384, ""startIndexInSegment"": 31, ""selectedText"": ""Phishing\"" is a scam where fraudsters pretend that they represent well-known companies to steal your personal information. If you receive an email claiming to be from Hat World that asks you for your personal information, do not respond. We will never request your password, user name, credit card information or other personal information through email."", ""value"": ""Other""}}",1694,"What is ""phishing""-   ""Phishing"" is a scam where fraudsters pretend that they represent well-known companies to steal your personal information. If you receive an email claiming to be from Hat World that asks you for your personal information, do not respond. We will never request your password, user name, credit card information or other personal information through email.  "
