annotation_ID,annotator_ID,segment_ID,category,policy_ID,segment_text,Other Type
24115,118,27,Practice not covered,133," Cookies    To enhance your experience on our Services, we may place ""cookies"" on your computer or device. Cookies are small text files that we place in your computer or device to store your preferences. Cookies, by themselves, do not tell us your e-mail address or other personal information unless you choose to provide this information to us by, for example, registering with one of our Services. Once you choose to provide us with personal information, this information may be linked to the data stored in the cookie. A cookie assigns a unique numerical identifier to your Web browser or device, and may enable us to recognize you as the same user who has used our Services, and relate your use of the Services to other information about you, such as your usage information and personal information.  ",Practice not covered
8802,95,31,Practice not covered,133,"HTML 5: HTML5, the language some Web sites are coded in, may be used to store information on your computer or device about your Service usage activities. This information may be retrieved by us to help us manage our Services, such as by giving us information about how our Services are being used by our visitors, how they can be improved, and to customize them for our users.  ",Practice not covered
24134,118,33,Practice not covered,133,"Web Beacons: Our websites may also use small pieces of code called ""web beacons"" or ""clear gifs"" to collect anonymous and aggregate advertising metrics, such as counting page views, promotion views, or advertising responses. A web beacon is an electronic image called a single-pixel or clear GIF. Web beacons can recognize certain types of information, such as a user's cookie number, time and date of a page view, and description of the page where the web beacon is placed. These web beacons may be used to deliver cookies that conform to our cookie policy above.  ",Practice not covered
8807,95,34,Practice not covered,133,"These tracking technologies may be deployed by us and/or by our service providers or partners on our behalf. These technologies enable us to assign a unique number to you, and relate your Service usage information to other information about you, including your personal information. We may match information collected from you through different means or at different times, including both personal information and Service usage information, and use such information along with offline and online information obtained from other sources (including third parties) such as demographic information and updated contact information (where that information has been lawfully disclosed to us) for the purposes of learning more about you so we can provide you with relevant content.  ",Practice not covered
24155,118,37,Practice not covered,133,"We encourage you to review, update, and correct the personal information that we maintain about you, and you may request that we delete personal information about you that is inaccurate, incomplete, or irrelevant for legitimate purposes, or are being processed in a way which infringes any applicable legal requirements, by contacting us as set out in the ""How to Contact Us"" section below. At our election, instead of deleting such information, we may retain it with your comment or correction noted in our records. By contacting us, you may also object to our further use of your personal information if you have compelling legitimate grounds (this may involve closing your account). We may ask you to verify your identity and to provide other details before we are able to provide you with any information, correct any inaccuracies, or delete any information. Your right to review, update, correct, and delete your personal information may be limited, subject to the law or your jurisdiction: (i) if your requests are abusive or unreasonably excessive, (ii) where the rights or safety of another person or persons would be encroached upon, or (iii) if the information or material you request relates to existing or anticipated legal proceedings between you and us, or providing access to you would prejudice negotiations between us or an investigation of possible unlawful activity. Your right to review, update, correct and delete your information is subject to our records retention policies and applicable law, including any statutory retention requirements.  ",Practice not covered
24148,118,38,Practice not covered,133," Retention of Personal Information    We will retain your personal information while you have an account with us and thereafter for as long as we need it for purposes not prohibited by applicable laws. Thereafter, we will either delete your personal information or de-identify it so that it is anonymous and not attributed to your identity. Your rights to request that we delete your personal information are set forth in the""Accessing, Correcting, and Deleting Your Personal Information"" section above.  ",Practice not covered
2813,88,5,Practice not covered,228,  Links Kinja contains links to other sites. Some of these links may be affiliate marketing links encoded by third parties. Such third parties do not collect any personally identifiable information unless you visit the referenced site. Please be aware that Kinja is not responsible for the privacy practices of such other sites. We encourage our users to be aware when they leave our site and to read the privacy statements of each and every Web site that collects personally identifiable information. This Privacy Policy applies solely to information collected by Kinja.  ,Practice not covered
2815,88,6,Practice not covered,228,"  Embedded Content You should also be aware that some content delivered through Kinja originates with another content provider. Such other content providers may place ""cookies"" on your computer, or otherwise gather information about you, including by asking you to provide information through the content player itself. Again, it is up to you to review the terms of use and privacy policy of the originators of such content.  ",Practice not covered
2827,88,11,Practice not covered,228,  Advertising and Cookies Some of our third party advertising partners may distribute cookies to users in advertisements that are provided to us. Kinja has no access to or control over these cookies once we have received the advertisements. Some of these advertisers and services we use to deliver advertising may be engaging in online behavioral advertising as defined by the Digital Advertising Alliance and FTC.  ,Practice not covered
2837,88,18,Practice not covered,228," 4. Contests, Sweepstakes, and Promotions    From time to time you may be able to participate in contests, giveaways, sweepstakes or other similar promotions we or third parties may sponsor. Participation may require sharing your personal information with us or third parties sponsoring the contest, giveaway, sweepstakes or promotion, and you should check the rules to determine how your information will be used and shared with others. Kinja may announce specific rules in connection with any such opportunity, but regardless of whether specific rules are announced, all such opportunities will be controlled by Kinja's ""Contest Policies"" set forth at Contest Guidelines. Any rules announced at the time of a contest will be in addition to the Contest Policies. In addition, as a condition to receiving any awards or prizes, you may be required to provide additional information, to sign a release, or to authorize the use of certain information about you in marketing materials. If a third party administers the contest, your participation may be subject to additional terms and conditions and that third party's privacy policy. We are not responsible for such third parties. You should carefully review the Contest Policies and these third parties' terms and conditions before deciding whether to participate in a contest publicized through the Service.  ",Practice not covered
9441,116,20,Practice not covered,928,"If you are a member of the FRED Network and select the option to allow your profile to be viewable by the public. By default this option is not selected, and your profile is not viewable by the public.  ",Practice not covered
9446,116,22,Practice not covered,928,The Federal Reserve Bank of St. Louis is under no obligation to use any Content submitted.  ,Practice not covered
9448,116,23,Practice not covered,928,"You may not submit Content that violates or infringes the rights of others including, without limitation, patent, trademark, trade secret, copyright, publicity or other proprietary rights.  ",Practice not covered
9450,116,25,Practice not covered,928,Any Content you submit will be considered to be non-proprietary and non-confidential.  ,Practice not covered
9839,117,26,Practice not covered,928,"The Federal Reserve Bank of St. Louis will have no obligations of any kind with respect to any Content you submit and users of the site will be free to edit, reproduce, use, disclose, publish and/or distribute any Content for any purpose whatsoever, without limitation.  ",Practice not covered
9840,117,27,Practice not covered,928,"You also agree that The Federal Reserve Bank of St. Louis will be free to use any ideas, concepts, artwork, inventions, developments, suggestions or techniques embodied in the Content for any purpose whatsoever, with or without attribution, and without compensation to you.  ",Practice not covered
24599,118,3,Practice not covered,676,To opt out of the DART cookies you may visit the Google ad and content network privacy policy at the following url http://www.google.com/privacy_ads.html Tracking of users through the DART cookie mechanisms are subject to Google's own privacy policies.  ,Practice not covered
24606,118,4,Practice not covered,676,"Other Third Party ad servers or ad networks may also use cookies to track users activities on this website to measure advertisement effectiveness and other reasons that will be provided in their own privacy policies, RestaurantNews.com has no access or control over these cookies that may be used by third party advertisers.  ",Practice not covered
24612,118,6,Practice not covered,676,Links to third party Websites   We have included links on this site for your use and reference. We are not responsible for the privacy policies on these websites. You should be aware that the privacy policies of these sites may differ from our own.  ,Practice not covered
13752,103,9,Practice not covered,676,"Last updated Sat, 31 Jul 2010 06:31",Practice not covered
11228,116,14,Practice not covered,1510,"From time to time, JibJab and one or more of its partners may co-sponsor a promotion, sweepstake or contest or may offer a co-branded product or service on the JibJab Sites (each, a ""Joint Offering""). Users may be asked to provide personal information such as name, email address, home address, etc. or to answer questions in order to participate in a Joint Offering, which personal information may be shared by JibJab with its partners involved in such Joint Offering, and such partners may use the information for its own advertising and marketing purposes. Also, we may transfer personal information to certain ad partners that you have explicitly requested to receive information from. It will be clear at the point of collection who is collecting the personal information and whose privacy statement will apply.  ",Practice not covered
11263,116,21,Practice not covered,1510,"Use of cookies (including Flash cookies) and Web Beacons by third-party advertisers is governed by the privacy policies of those advertisers - not the JibJab Privacy Policy. JibJab has no control over what information is collected by third-party advertisers or how they may use the information. The privacy policies and data practices of such third-party advertisers may significantly differ from those of JibJab, and JibJab makes no representation or warranty whatsoever about third-party advertisers' data policies and practices. For more information regarding the data practices of some of these third-party advertisers and how to opt out of their use of your information, please visit  ",Practice not covered
10478,118,21,Practice not covered,1510,"Use of cookies (including Flash cookies) and Web Beacons by third-party advertisers is governed by the privacy policies of those advertisers - not the JibJab Privacy Policy. JibJab has no control over what information is collected by third-party advertisers or how they may use the information. The privacy policies and data practices of such third-party advertisers may significantly differ from those of JibJab, and JibJab makes no representation or warranty whatsoever about third-party advertisers' data policies and practices. For more information regarding the data practices of some of these third-party advertisers and how to opt out of their use of your information, please visit  ",Practice not covered
11264,116,22,Practice not covered,1510," http://www.networkadvertising.org/choices/completed .    The JibJab Sites also contain links to and/or enables certain third-party Internet functionalities to enhance your online experience, including, without limitation, social plug-ins, tools and APIs. Prior to using any third-party functionalities (e.g., Facebook Connect) on the JibJab Sites, you should consult the privacy notices of the third-party providers of such functionalities (e.g., Facebook). Once again, we have no control over what information is collected by such third parties, or how they may use the information. The privacy policies and data practices of such third parties may significantly differ from ours, and we make no representation or warranty whatsoever about their data policies and practices. Your communications and interactions with such third parties are solely between you and them, and are at your own risk.  ",Practice not covered
11265,116,23,Practice not covered,1510,"SPECIAL NOTE - Flash Cookies:   Flash cookies (also known as ""local shared objects"" or ""LSOs"") cannot be rejected, disabled, turned off, opted out, or deleted in the same way as regular cookies such as HTML cookies. Flash cookies may remain on your computer even after you have rejected, disabled, opted out or deleted regular cookies. For information on how to manage and remove Flash cookies, please visit:     http://helpx.adobe.com/flash-player/kb/disable-local-shared-objects-flash.html     http://epic.org/privacy/cookies/flash.html     http://www.aboutcookies.org/Default.aspx?page=2     http://www.macromedia.com/support/documentation/en/flashplayer/help/settings_manager07.html  ",Practice not covered
11279,116,30,Practice not covered,1510,"Third-Party Sites   The JibJab Sites contain links to third-party sites. Unless expressly otherwise stated by JibJab, JibJab is not responsible for the privacy policies and/or practices of linked third-party sites. When you leave a JibJab Site and go to a third-party site, our Privacy Policy will no longer apply, and any information collected from or about you on the third-party site will be governed by the privacy policy of that third party. Third-party sites' privacy policies and data practices may be substantially different from those of JibJab. They may send their own cookies, web beacons, etc. to your computer or mobile device, and may collect data about you and make use of the data in ways that we would not. You access such third-party sites entirely at your own risk. You should always read the privacy policy of a third-party site before disclosing any personal information on that site.  ",Practice not covered
11280,116,31,Practice not covered,1510,"For example, some of the JibJab Sites allow you to check out through Paypal. If you choose to use Paypal, your use of the Paypal service (including any personal information you submit to Paypal) is subject to and governed by Paypal's privacy policy, and not JibJab's. Also, when you purchase a JibJab mobile app from a third-party app store (e.g., Apple/iTunes), your purchase is with the third-party app store and not with JibJab, and accordingly, any personal information you submit to the third-party app store in connection with the purchase is subject to and governed by the privacy policy of the third-party app store, and not JibJab's.  ",Practice not covered
10525,118,31,Practice not covered,1510,"For example, some of the JibJab Sites allow you to check out through Paypal. If you choose to use Paypal, your use of the Paypal service (including any personal information you submit to Paypal) is subject to and governed by Paypal's privacy policy, and not JibJab's. Also, when you purchase a JibJab mobile app from a third-party app store (e.g., Apple/iTunes), your purchase is with the third-party app store and not with JibJab, and accordingly, any personal information you submit to the third-party app store in connection with the purchase is subject to and governed by the privacy policy of the third-party app store, and not JibJab's.  ",Practice not covered
11282,116,32,Practice not covered,1510,Public Communication   Please be aware that whenever you voluntarily post information on the JibJab Site(s) that that information can be accessed by the public and can in turn be used by those people to send you unsolicited communications. We are not responsible for the personally identifiable information you choose to submit in these forums.  ,Practice not covered
11291,116,36,Practice not covered,1510,"Security   JibJab user accounts are secured by user-created passwords and, in some cases, third-party sign-on services (e.g., Facebook Connect). JibJab takes precautions to ensure that user account information is kept private. We use commercially reasonable measures to protect user information that is stored within our database, and we restrict access to user information to those employees who need access to perform their job functions, such as our customer service personnel and technical staff. However, we do not guarantee that these efforts will completely protect user account information. Unauthorized entry or use, hardware or software failure, and other factors may compromise the security of user information at any time. We will endeavor to notify users in the event that the security of their personal information is breached or compromised. By submitting personal information on any of the JibJab Sites, you expressly consent to receiving our notification regarding any breach or compromise, or suspected breach or compromise, of the security of your personal information, by email or postal mail, as we deem appropriate, and as required by law. For any additional information about the security measures we use on JibJab, please contact us at: support@jibjab.com .",Practice not covered
10451,118,40,Practice not covered,1510,"Some of the JibJab Sites and JibJab Services, such as StoryBots.com, are designed for parents and their young children. Children can only access and use such sites and services with the participation and supervision of their parents. Because of the young age of our children users, only parents are allowed to create accounts and profiles and to upload personal content on such sites and services. JibJab does not knowingly collect any personal information directly from children on such sites and services. We also take certain measures to prevent children from submitting personal information to us or from accessing features that may collect or publish such information.  ",Practice not covered
3253,88,1,Practice not covered,325,"As part of this sale, Freedom will be transferring to Publisher customer data collected from users of the Properties websites. Customer data transferred to Publisher will be held and maintained by Publisher pursuant to Publishers respective privacy policies, which can be found at the following: http://lima.ohcommedia.com, http://sedalia.ohcommedia.com, http://jacksonville.ohcommedia.com and http://alton.ohcommedia.com. Please do not register or submit information to any of the Properties websites if you do not want your customer data transferred to Publisher.  ",Practice not covered
3406,88,13,Practice not covered,325,"We may work with third-party advertising companies which may use information about your visit to the Site in order to provide advertisements about goods and services that may be of interest to you on the Site and on third-party Web sites. From the Site, these companies may place or recognize a unique cookie on your computer or use other technologies such as Web beacons or pixel tags. Our Privacy Policy does not cover any use of information that a third-party advertisement serving company may collect from you. For more information about ad cookies and companies that provide users the ability to ""opt-out"" of the collection of information from such cookies, please click here.  ",Practice not covered
3403,88,16,Practice not covered,325," Links To Third-Party Web Sites    The Site may contain links to Web sites operated and maintained by third parties, over which we have no control. Privacy policies on such linked Web sites may be different from our Privacy Policy. You access such linked Web sites at your own risk. You should always read the privacy policy of a linked Web site before disclosing any personal information on such site.  ",Practice not covered
3405,88,17,Practice not covered,325," Discussion Board, Forums and Other User Generated Content    Our online chat areas, bulletin boards, social networks, mobile messaging services, other public forums and user-generated content (i.e., photos, videos) can be a useful way for you to express yourself to other online users. When you post messages or otherwise use these features, the information that you provide (including personal information) may be publicly available to, collected by, and used by third parties. We are not responsible for the content of such messages or images posted by users or such disclosures of personal information.  ",Practice not covered
9338,103,2,Practice not covered,58,"b. This privacy policy does not apply to information collected about you by anyone except Hearst and only applies to the Covered Sites(defined above). This privacy policy does not apply to Hearst websites which are not linked to this policy and does not apply to non-Hearst websites, including those linked to or advertised on a Covered Site. Any information you provide when you visit websites other than those covered by this policy will be subject to the privacy policies posted on those sites.  ",Practice not covered
9339,103,3,Practice not covered,58,"c. We may offer our Magazines through certain third party websites via a subscription page on such third party websites that is linked to this policy. For the avoidance of doubt, such subscription page is a ""Covered Site"" and this policy applies to information collected through the subscription page, but does not apply to information collected through the third party website.  ",Practice not covered
24854,118,3,Practice not covered,58,"c. We may offer our Magazines through certain third party websites via a subscription page on such third party websites that is linked to this policy. For the avoidance of doubt, such subscription page is a ""Covered Site"" and this policy applies to information collected through the subscription page, but does not apply to information collected through the third party website.  ",Practice not covered
9342,103,5,Practice not covered,58,"e. Certain features of the Covered Sites may be subject to additional or different privacy provisions, which will be posted on the CoveredSite in connection with such features. All such additional or different privacy provisions are incorporated by reference into this privacy policy.  ",Practice not covered
24891,118,9,Practice not covered,58,"(iii) If you don't want cookies, most Web browsers include an option that allows you to not accept them. However, if you set your browser to refuse cookies, some portions of our Covered Sites may not function efficiently. Flash cookies may regenerate HTTP cookies that you have affirmatively deleted. Deleting, rejecting, disabling or turning offHTTP cookies as described above will not remove flash cookies. We use flash cookies as an alternative method to HTTP cookies for storing information about your web browsing history across unaffiliated domains, unrelated to the delivery of content through the FlashPlayer or the performance of the Flash Player in delivering such content. You can manage and delete flash cookies by visiting http://kb2.adobe.com/cps/526/52697ee8.html.  ",Practice not covered
8251,95,17,Practice not covered,58,"b. We may combine and use any and all information we collect on you either online or otherwise, including from third parties, for marketing purposes.  ",Practice not covered
