annotation_ID,annotator_ID,segment_ID,category,policy_ID,segment_text,Other Type
16897,116,17,Practice not covered,1361,"We transfer information about you if Yahoo is acquired by or merged with another company. In this event, Yahoo will notify you before information about you is transferred and becomes subject to a different privacy policy. ",Practice not covered
18614,121,18,Practice not covered,1361,"Yahoo displays targeted advertisements based on personal information. Advertisers (including ad serving companies) may assume that people who interact with, view, or click targeted ads meet the targeting criteria""for example, women ages 18-24 from a particular geographic area.   Yahoo does not provide any personal information to the advertiser when you interact with or view a targeted ad. However, by interacting with or viewing an ad you are consenting to the possibility that the advertiser will make the assumption that you meet the targeting criteria used to display the ad.  Yahoo advertisers include financial service providers (such as banks, insurance agents, stock brokers and mortgage lenders) and non-financial companies (such as stores, airlines, and software companies). ",Practice not covered
16900,116,18,Practice not covered,1361,"Yahoo displays targeted advertisements based on personal information. Advertisers (including ad serving companies) may assume that people who interact with, view, or click targeted ads meet the targeting criteria""for example, women ages 18-24 from a particular geographic area.   Yahoo does not provide any personal information to the advertiser when you interact with or view a targeted ad. However, by interacting with or viewing an ad you are consenting to the possibility that the advertiser will make the assumption that you meet the targeting criteria used to display the ad.  Yahoo advertisers include financial service providers (such as banks, insurance agents, stock brokers and mortgage lenders) and non-financial companies (such as stores, airlines, and software companies). ",Practice not covered
18609,121,21,Practice not covered,1361,"Yahoo lets other companies that show advertisements on some of our pages set and access their cookies on your computer. Other companies' use of their cookies and device identifiers is subject to their own privacy policies, not this one. Advertisers or other companies do not have access to Yahoo's cookies.  ",Practice not covered
18603,121,25,Practice not covered,1361,"We reserve the right to send you certain communications relating to the Yahoo service, such as service announcements, administrative messages and the Yahoo Newsletter, that are considered part of your Yahoo account, without offering you the opportunity to opt out of receiving them.  ",Practice not covered
13141,121,7,Practice not covered,523,Unauthorized attempts to upload information or change information on this service are strictly prohibited and may be punishable under the Computer Fraud and Abuse Act of 1986 and the National Information Infrastructure Protection Act.  ,Practice not covered
11938,118,7,Practice not covered,523,Unauthorized attempts to upload information or change information on this service are strictly prohibited and may be punishable under the Computer Fraud and Abuse Act of 1986 and the National Information Infrastructure Protection Act.  ,Practice not covered
11942,118,13,Practice not covered,523," Accessibility Policy    USA.gov is committed to providing access to all individualswith or without disabilitiesseeking information on USA.gov. To provide this information, we've built USA.gov to conform to Section 508 of the Rehabilitation Act (as amended). Section 508 requires that all individuals with disabilities (whether federal employees or members of the general public) have access to, and use of, information and data comparable to that provided to individuals without disabilities, unless an undue burden would be imposed on us.  ",Practice not covered
13150,121,15,Practice not covered,523," External Links    USA.gov links to many websites created and maintained by other public and/or private organizations as outlined in our Linking Policy. If you click a link to an outside website, such as Facebook or YouTube, you will leave the USA.gov site and are subject to the privacy and security policies of the owners/sponsors of the outside website.  ",Practice not covered
11944,118,15,Practice not covered,523," External Links    USA.gov links to many websites created and maintained by other public and/or private organizations as outlined in our Linking Policy. If you click a link to an outside website, such as Facebook or YouTube, you will leave the USA.gov site and are subject to the privacy and security policies of the owners/sponsors of the outside website.  ",Practice not covered
3385,82,26,Practice not covered,175," Other Information     No Spyware or Adware.    We do not install any spyware or adware in connection with our Services, or distribute any commercial message, or authorize any third party to distribute any commercial message, by means of spyware or adware. ""Spyware"" or ""adware"" is any software which has been downloaded to or installed on an Internet user's computer or device, without the user's actual consent, and facilitates the distribution of any commercial message to the user. If you feel you may have spyware from another company installed on your machine, there are various anti-spyware/adware software applications available on the Internet to identify if this has occurred.  ",Practice not covered
3431,88,28,Practice not covered,175," Links.    Our Services contain links to other websites and products produced by MLB Advanced Media, L.P. and to websites and products operated by unrelated third parties. In addition, if you click on an advertisement within our Services, you may be directed to a web page within our Services or to a third-party website or product. We are not responsible for the privacy practices of third party websites or products, and we encourage you to read the privacy policies of every website and product that collects personally identifiable information from you. This Privacy Policy applies only to our Services, unless you are notified otherwise upon accessing any third party website or product, in which case the terms and conditions set forth in such notification will apply.  ",Practice not covered
3444,82,28,Practice not covered,175," Links.    Our Services contain links to other websites and products produced by MLB Advanced Media, L.P. and to websites and products operated by unrelated third parties. In addition, if you click on an advertisement within our Services, you may be directed to a web page within our Services or to a third-party website or product. We are not responsible for the privacy practices of third party websites or products, and we encourage you to read the privacy policies of every website and product that collects personally identifiable information from you. This Privacy Policy applies only to our Services, unless you are notified otherwise upon accessing any third party website or product, in which case the terms and conditions set forth in such notification will apply.  ",Practice not covered
7741,95,0,Practice not covered,807," Terms and Conditions    Please refer to the order terms below. If you have any further questions, please contact us.     Web orders will ship 5-7 business days from the time of purchase.   Any defective items purchased directly from Lodge are eligible for full refund or exchange by contacting customer service.   Shipping for returns/exchanges due to non-defect reasons (i.e. wrong size, color, no longer desired) will be the responsibility of the customer.   Items bought from retailers should be returned/exchanged at the place of purchase.   Transactions are transmitted using 128-bit secure socket layers (SSL) for up-to-date data protection  ",Practice not covered
23772,123,32,Practice not covered,807,"We also agree to the individual redress principle, which requires that individuals have a right to pursue legally enforceable rights against data collectors and processors who fail to adhere to the law. This principle requires not only that individuals have enforceable rights against data users, but also that individuals have recourse to courts or a government agency to investigate and/or prosecute non-compliance by data processors.  ",Practice not covered
4447,95,4,Practice not covered,541,"We use reasonable precautions to protect your information and voluntarily abide by the guidelines outlined in the Family Educational Rights and Privacy Act to maintain your privacy. By using our website, you agree to the transfer of information to countries outside the United States that have institution and service providers associated with our overseas programs.  ",Practice not covered
7491,103,7,Practice not covered,541," Links to Other Websites   The IFSA-Butler website contains links to other websites that may or may not be affiliated with the Institute for Study Abroad, Butler University. IFSA-Butler is not responsible for the content or privacy practices on these websites, nor does the posting of a link constitute an endorsement by IFSA-Butler of said website.  ",Practice not covered
4460,95,12,Practice not covered,541,"All textual, graphic and other content appearing on this website are the property of the Institute for Study Abroad, Butler University (IFSA-Butler). Copyright 2004-2010. Institute for Study Abroad, 1100 W. 42nd St., Suite 305, Indianapolis, Indiana 46208 USA. All Rights Reserved.  ",Practice not covered
7499,103,12,Practice not covered,541,"All textual, graphic and other content appearing on this website are the property of the Institute for Study Abroad, Butler University (IFSA-Butler). Copyright 2004-2010. Institute for Study Abroad, 1100 W. 42nd St., Suite 305, Indianapolis, Indiana 46208 USA. All Rights Reserved.  ",Practice not covered
11039,118,7,Practice not covered,59,"TRACKING & THIRD PARTY COOKIES   You may have read about ""cookies"" or bits of information that are placed by a Website in a storage place on your own computer. As with most other Web sites, the Liquor.com does use cookies but only to allow us to quickly check your status as a subscriber and facilitate access to your preferences. Some of our advertisers may serve you cookies as well. Unfortunately, we do not have control over cookies placed by advertisers. If you don't want cookies, your Web browser likely includes an option that allows you to not accept them.  ",Practice not covered
10241,121,10,Practice not covered,59,"LINKS TO OTHER SITES   As part of the service, Liquor.com may create links allowing you to access third party sites. Liquor.com is not responsible for the content that appears on those sites and does not endorse these sites. Please consult those sites' individual privacy policies in order to determine how they treat user information.  ",Practice not covered
14874,121,2,Practice not covered,940,"This privacy policy applies to our sites and services on which we display or post a direct link to this privacy policy. This privacy policy does not apply to those sites and services that do not display or link to this privacy policy, or that have their own privacy policies. However, we often acquire new companies to expand our business. Some acquired companies may operate under their own privacy policies until we integrate their privacy practices with ours.  ",Practice not covered
14893,121,14,Practice not covered,940,"Access to Your Data if you are our customer and use certain services. interactive tools or authorize us to retrieve information from another database, user, or other third party on your behalf, such as integrating a practice management system with your services, then you may elect to download certain installed tools, which may collect and transmit information from your computer system solely relating to the use of the installed tools and for the purpose of providing you with relevant services. ",Practice not covered
14311,116,14,Practice not covered,940,"Access to Your Data if you are our customer and use certain services. interactive tools or authorize us to retrieve information from another database, user, or other third party on your behalf, such as integrating a practice management system with your services, then you may elect to download certain installed tools, which may collect and transmit information from your computer system solely relating to the use of the installed tools and for the purpose of providing you with relevant services. ",Practice not covered
14916,121,35,Practice not covered,940,"In addition to the uses described above, we may use personal information that we collect for other purposes that are disclosed to you at the time we collect the information, or with your consent.  ",Practice not covered
14362,116,48,Practice not covered,940,"Some of our services are co-branded by Internet Brands and other companies with which we partner. If you register to or use such a service, both our privacy policy and the partner's privacy policy may be displayed and apply. If that is the case, both Internet Brands and the partner will receive personal information you provide. ",Practice not covered
15448,118,48,Practice not covered,940,"Some of our services are co-branded by Internet Brands and other companies with which we partner. If you register to or use such a service, both our privacy policy and the partner's privacy policy may be displayed and apply. If that is the case, both Internet Brands and the partner will receive personal information you provide. ",Practice not covered
15050,121,54,Practice not covered,940," User Generated Content, Online Communities and Forums, Profiles and Reviews    You may choose to publicly disclose personal information about yourself and others in the course of (i) contributing user generated content (for instance articles, blogs, surveys, reviews, ratings, or podcasts), (ii) communicating with others in our online forums, communities, or chat rooms, (iii) creating user profiles for public view, or (iv) posting images, photos, or videos. Be aware, information that you voluntarily disclose in any of these areas of our sites or services is unencrypted, public information and, therefore, there can be no expectation of privacy or confidentiality, except if the terms and conditions of the site or service specifically limit use of the content (for example, we may let you know how such survey and rating responses will be used and if anonymity is an option).  ",Practice not covered
14388,116,57,Practice not covered,940,"To view and change the personal information that you directly provided to us, you can return to the web page on our site where you originally submitted the data and follow the instructions on that web page. ",Practice not covered
14401,116,66,Practice not covered,940,"Please be aware that certain records and information will be retained for specific purposes such as legal, payment, accounting, technical, dispute resolution, enforcement of our sites. and services' terms of use, or customer service. If you have posted comments or user generated content on our site, we may not be able to delete it. Further, we take no responsibility for removing or editing any of your public activities or any submissions or content that is a result of your public activities, except as provided in this privacy policy or the sites. or services' terms of use.  ",Practice not covered
15084,121,67,Practice not covered,940,"We may reject requests that are unreasonably repetitive, require disproportionate technical effort (for example, developing a new system or fundamentally changing an existing practice), risk the privacy of others, or would be extremely impractical (for instance, requests concerning information residing on backup tapes).  ",Practice not covered
14402,116,67,Practice not covered,940,"We may reject requests that are unreasonably repetitive, require disproportionate technical effort (for example, developing a new system or fundamentally changing an existing practice), risk the privacy of others, or would be extremely impractical (for instance, requests concerning information residing on backup tapes).  ",Practice not covered
14642,118,67,Practice not covered,940,"We may reject requests that are unreasonably repetitive, require disproportionate technical effort (for example, developing a new system or fundamentally changing an existing practice), risk the privacy of others, or would be extremely impractical (for instance, requests concerning information residing on backup tapes).  ",Practice not covered
15493,118,75,Practice not covered,940,"It is important to remember, however, that no system can guarantee 100 security at all times. Accordingly, we cannot guarantee the security of information stored on or transmitted to or from our services. We cannot assume responsibility or liability for unauthorized access to our servers and systems. When disclosing any personal or protected health information, you should remain mindful of the fact that it is potentially accessible to the public and,consequently, can be collected and used by others without your consent. Accordingly, you should consider carefully if you want to submit sensitive information that you would not want disclosed to the public and should recognize that your use of the Internet and our sites and services is solely at your risk. You are ultimately responsible for maintaining the secrecy for all your personal information, including your protected health information. Except as provided in aBusiness Associate Agreement between us and a healthcare provider, we have no responsibility or liability to anyone for the security of your personal or protected health information transmitted via the Internet.  ",Practice not covered
14432,116,85,Practice not covered,940," Linked Websites and Services    Our sites and services may link to other sites or services operated by our affiliates or third parties, and may carry advertisements or offer content, functionality, newsletters, contests or sweepstakes, or applications developed and maintained by third parties. We do not exercise control over third party sites or services. We are not responsible for the privacy practices of any such third parties. Once you leave our sites or services via a link, enable a third-party service, or click an advertisement, you should check the applicable privacy policy of the third-party's site or service. The fact that we link to a website or present a banner ad or other type of advertisement is not an endorsement, authorization or representation of our affiliation with that third party, nor is it an endorsement of their privacy or information security policies or practices.  ",Practice not covered
15112,121,86,Practice not covered,940,"We may also provide social media features on our sites and services that enable you to share personal information with your social network(s) and to interact with our sites and services. Depending on the features, your use of these features may result in the collection or sharing of personal information about you. We encourage you to review the privacy policies and settings on the social media site(s) with which you interact.  ",Practice not covered
14434,116,86,Practice not covered,940,"We may also provide social media features on our sites and services that enable you to share personal information with your social network(s) and to interact with our sites and services. Depending on the features, your use of these features may result in the collection or sharing of personal information about you. We encourage you to review the privacy policies and settings on the social media site(s) with which you interact.  ",Practice not covered
15113,121,87,Practice not covered,940," HIPAA    Our sites and services may include collection, transmission and storage of protected health information you submit for healthcare providers or that healthcare providers submit to us and is subject to special rules under the Health Insurance Portability and Accountability Act of 1996 or ""HIPAA"". Our use and disclosure of your protected health information or a healthcare providers data that you or the healthcare provider submits with certain sites and services, is governed by HIPAA.  ",Practice not covered
15430,118,87,Practice not covered,940," HIPAA    Our sites and services may include collection, transmission and storage of protected health information you submit for healthcare providers or that healthcare providers submit to us and is subject to special rules under the Health Insurance Portability and Accountability Act of 1996 or ""HIPAA"". Our use and disclosure of your protected health information or a healthcare providers data that you or the healthcare provider submits with certain sites and services, is governed by HIPAA.  ",Practice not covered
15114,121,88,Practice not covered,940," Use and Disclosure of Your Protected Health Information    When you use certain services (for example, appointment request) all protected health information that you submit is used and disclosed by us as a Business Associate (as defined by HIPAA) according to the terms of a Business Associate Agreement between us and that healthcare provider. This means that we may only use and disclose your protected health information on behalf of, or to provide services to, the healthcare provider according to the Business Associate Agreement. There are three exceptions to this use and disclosure rule. We may use and disclose your protected health information (i) for our internal management and administration; (ii) to carry out our legal responsibilities; and (iii) to perform certain data aggregation services for the healthcare provider and other healthcare providers; provided that, any disclosures for our internal management and administration or to carry out our legal responsibilities are either required by law or made after we obtain reasonable assurances from the person to whom the protected health information is disclosed that it will be held confidentially and used or further disclosed only as required by law or for the purpose for which it was disclosed to that person.  ",Practice not covered
15115,121,89,Practice not covered,940,Some of the services for a particular healthcare provider may be provided by our subcontractors. The subcontractor must comply with the same terms and conditions for the protected health information that apply to us as a Business Associate of the healthcare provider.  ,Practice not covered
14453,116,89,Practice not covered,940,Some of the services for a particular healthcare provider may be provided by our subcontractors. The subcontractor must comply with the same terms and conditions for the protected health information that apply to us as a Business Associate of the healthcare provider.  ,Practice not covered
15500,118,89,Practice not covered,940,Some of the services for a particular healthcare provider may be provided by our subcontractors. The subcontractor must comply with the same terms and conditions for the protected health information that apply to us as a Business Associate of the healthcare provider.  ,Practice not covered
15116,121,90,Practice not covered,940,"As a Business Associate of a particular healthcare provider, we may be permitted to de-identify your protected health information created or received by us for that healthcare provider. This de-identified information must be created according to criteria prescribed by HIPAA so that there is no reasonable basis to believe that this information can be traced back to you. We may use and disclose any such de-identified information in the same manner as personal information under this privacy policy.  ",Practice not covered
14454,116,90,Practice not covered,940,"As a Business Associate of a particular healthcare provider, we may be permitted to de-identify your protected health information created or received by us for that healthcare provider. This de-identified information must be created according to criteria prescribed by HIPAA so that there is no reasonable basis to believe that this information can be traced back to you. We may use and disclose any such de-identified information in the same manner as personal information under this privacy policy.  ",Practice not covered
15501,118,90,Practice not covered,940,"As a Business Associate of a particular healthcare provider, we may be permitted to de-identify your protected health information created or received by us for that healthcare provider. This de-identified information must be created according to criteria prescribed by HIPAA so that there is no reasonable basis to believe that this information can be traced back to you. We may use and disclose any such de-identified information in the same manner as personal information under this privacy policy.  ",Practice not covered
15117,121,91,Practice not covered,940,"The descriptions in this privacy policy of the HIPAA responsibilities and obligations of Internet Brands and any subcontractor do not provide any right to you under this privacy policy, HIPAA, or any other law.  ",Practice not covered
