annotation_ID,annotator_ID,segment_ID,category,policy_ID,segment_text,Other Type
15808,116,4,Practice not covered,414,"In addition, our site uses third-party software to analyze the web pages within our site that your computer visits. This information, called ""clickstream data,"" is associated with your computer's IP address. We do not associate clickstream data with your name, mailing address, or any other personal information. We collect clickstream data to analyze which portions of our site draw the most traffic so we can improve performance of our site. We also may track how many recipients of our e-mail newsletters click through to other sites. This clickstream data may be shared, in aggregate and anonymous form, with third-party advertisers. We do not associate clickstream data with personally identifiable information.  ",Practice not covered
15813,116,5,Practice not covered,414," What We Do with Information We Collect from You    We use any information we collect from you in accordance with applicable laws. We may use aggregated information--information that cannot be used to identify you individually--in many ways. For example, we may combine information about your usage patterns with the usage patterns of other users to identify pages on our website that are frequently visited so we can improve our site's performance. We may occasionally share aggregated, anonymous information with our business partners and affiliates and/or with third-party advertisers, but this information cannot be traced back to you individually or used to contact you.  ",Practice not covered
16516,121,9,Practice not covered,414,"Like any other company, we may sell, buy, merge, or partner with other companies or businesses. In such transactions, information about our subscribers and website visitors may be among the transferred assets. We may also disclose your information in response to a court order or other valid legal process or at other times when we believe we are reasonably required to do so by law, in connection with payments you may owe to us, and/or whenever we deem it appropriate or necessary to give such information to law-enforcement authorities. At our discretion, we may not provide you with notice prior to such disclosures.  ",Practice not covered
16522,121,13,Practice not covered,414," Affiliated Websites, Third-Party Linked Sites, and Third-Party Advertisements    The ads appearing on this web site are delivered to you by our web advertising partners, including DoubleClick and Google. Washingtonian.com expects its business partners, advertisers, and third-party affiliates to respect the privacy of our users. However, third parties' web sites - including those of our partners, advertisers, affiliates, and other content providers'- have their own privacy practices and policies. When you click on a banner advertisement or link from Washingtonian.com to an external Web site, you should review that site's Privacy Policy before submitting any personal information on the site.  ",Practice not covered
15837,116,13,Practice not covered,414," Affiliated Websites, Third-Party Linked Sites, and Third-Party Advertisements    The ads appearing on this web site are delivered to you by our web advertising partners, including DoubleClick and Google. Washingtonian.com expects its business partners, advertisers, and third-party affiliates to respect the privacy of our users. However, third parties' web sites - including those of our partners, advertisers, affiliates, and other content providers'- have their own privacy practices and policies. When you click on a banner advertisement or link from Washingtonian.com to an external Web site, you should review that site's Privacy Policy before submitting any personal information on the site.  ",Practice not covered
16524,121,14,Practice not covered,414,"Our Web advertising partners send us aggregate, anonymous information about visits to this site, such as the number of times visitors clicked on a particular advertisement - but not visitors' names, addresses, or other personal information.  ",Practice not covered
15847,116,18,Practice not covered,414, Changes to This Policy    Washingtonian.com reserves the right to change this policy at any time. Please check this page periodically for changes. We will post a notice on this site if and when this policy changes to alert visitors that a new policy is in place. Your continued use of our website following the posting of changes to our privacy policy will mean that you accept such changes. Information collected prior to the time any change is posted will be used according to the policy and applicable laws in place at the time the information was collected.  ,Practice not covered
16530,121,19,Practice not covered,414," Governing Law    This policy and the use of this website are governed by District of Columbia law. Any claim related to the website or this policy shall be brought in a federal or state court in Washington, D.C., within one year after the claim arises. You agree that no such claim may be brought as a class action. Users of Washingtonian.com consent to the jurisdiction and venue of such court as the most convenient and appropriate for the resolution of disputes concerning this policy. Washingtonian.com is controlled, operated, and administered entirely within the United States. If you are located outside the United States, please note that the information you provide to us will be transferred to the United States. You hereby consent to this transfer.  ",Practice not covered
15848,116,19,Practice not covered,414," Governing Law    This policy and the use of this website are governed by District of Columbia law. Any claim related to the website or this policy shall be brought in a federal or state court in Washington, D.C., within one year after the claim arises. You agree that no such claim may be brought as a class action. Users of Washingtonian.com consent to the jurisdiction and venue of such court as the most convenient and appropriate for the resolution of disputes concerning this policy. Washingtonian.com is controlled, operated, and administered entirely within the United States. If you are located outside the United States, please note that the information you provide to us will be transferred to the United States. You hereby consent to this transfer.  ",Practice not covered
2397,88,10,Practice not covered,1070," Third party advertising and your choices.    Third parties whose products or services are accessible or advertised via the Services may also place cookies or other tracking technologies on your computer, mobile phone, or other device to collect non-personal information about your use of the Services. We also allow other third parties (e.g., ad networks and ad servers) to serve tailored ads to you on the Services, and to access their own cookies or other tracking technologies on your computer, mobile phone, or other device you use to access the Services. We neither have access to, nor does this Policy govern, the use of cookies or other tracking technologies that may be placed on your computer, mobile phone, or other device you use to access the Services by non-affiliated, third-party ad technology, ad servers, ad networks or any other non-affiliated third parties. Those parties that use these technologies may offer you a way to opt out of ad targeting as described below. You may receive tailored advertising on your computer through a web browser. If you are interested in more information about tailored browser advertising and how you control cookies from being put on your computer to deliver tailored advertising, you may visit the Network Advertising Initiatives website and/or the Digital Advertising Alliances website. You also can control advertising cookies from Google, by using its Ads Preference Manager . Please note that to the extent advertising technology is integrated into the Services, you may still receive advertisements even if you opt-out of tailored advertising.  ",Practice not covered
2488,88,18,Practice not covered,1070,"  When you sign up to participate in a contest or sweepstakes, your information may also be provided to our sweepstakes or contest advertisers, operators, or sponsors and the use of that information will be also governed by those advertisers, operators, or sponsors privacy policies or practices.  ",Practice not covered
1231,82,24,Practice not covered,1070, Linked sites and advertisements.    The Services may contain links to third-party websites. We are not responsible for the privacy practices or the content of those third-party websites.  ,Practice not covered
2501,88,24,Practice not covered,1070, Linked sites and advertisements.    The Services may contain links to third-party websites. We are not responsible for the privacy practices or the content of those third-party websites.  ,Practice not covered
2503,88,25,Practice not covered,1070,"We have relationships with third-party providers to provide content, products, services, and functionality through the Services. When you visit sites or use any Services provided in conjunction with one or more of these third-party providers and the brands of those providers appear on the site or Services in connection with such content, products, services, or functionality, we may share any information you provide or that is collected during your use of those Services with those providers. In some cases, the provider may collect information from you directly, in which case the providers privacy policy (which may differ from this Privacy Policy) would apply. If you have any questions regarding the privacy policy of any of our providers, you should contact the provider directly for more information.  ",Practice not covered
1224,82,30,Practice not covered,1070, No rights of third parties.    This Privacy Policy does not create rights enforceable by third parties.  ,Practice not covered
1524,84,30,Practice not covered,1070, No rights of third parties.    This Privacy Policy does not create rights enforceable by third parties.  ,Practice not covered
24187,118,2,Practice not covered,1306," Information We Collect    Chase Paymentech's customers, the customers of its affiliates, and the customers of other third-parties for which Chase Paymentech may provide outsourced or subcontracted processing services, (""Merchants"") are businesses and other legal entities desiring to accept credit or debit cards or other payment methods, as payment for goods or services. Chase Paymentech does not have direct relationships with, or collect information directly from, individual consumers other than in their capacity as owners or operators of a commercial enterprise. Chase Paymentech does not provide services for consumer, personal, family or household purposes. The information we receive and collect is strictly related to our business customers and the payment transactions that we assist them in executing, as well as from prospective or potential business customers or website visitors who may be interested in learning more about our services (""Customer Data""). The transaction information we receive from our Merchants may include personal financial information about their customers or applicants (e.g., name, address, credit or debit card account numbers and expiration dates, etc.) who may be individual consumers and other cardholders (""Cardholder Data""). Chase Paymentech understands that such information is sensitive and takes appropriate steps to protect the confidentiality and security of all information collected by Chase Paymentech in accordance with this Privacy Statement.  ",Practice not covered
9576,95,10,Practice not covered,1306," Responsibility of Merchants    Merchants are also required to comply with various rules and regulations of the various credit and debit card organizations and networks relating to the security and safeguarding Cardholder Data, including, but not limited to, PCI, CISP and SDP. Merchants may be required to undergo periodic third-party data security assessments and periodic network scans to ensure that appropriate security measures are in place.  ",Practice not covered
12694,103,10,Practice not covered,1306," Responsibility of Merchants    Merchants are also required to comply with various rules and regulations of the various credit and debit card organizations and networks relating to the security and safeguarding Cardholder Data, including, but not limited to, PCI, CISP and SDP. Merchants may be required to undergo periodic third-party data security assessments and periodic network scans to ensure that appropriate security measures are in place.  ",Practice not covered
24177,118,18,Practice not covered,1306," Third-Party Web Sites.  Chase Paymentech may create links to third-party Web sites. In addition, Chase Paymentech may authorize third-parties to create links to Chase Paymentech websites. Chase Paymentech is not responsible for the content or privacy practices employed by third-party Web sites. Nor does Chase Paymentech control or warrant the utility, merchantability or workmanship of the products or services offered at third-party Web sites.  ",Practice not covered
10833,116,8,Practice not covered,1259,"If you use a Motley Fool application on a third party site or mobile device we may collect data about you including your email address. We will let you know what data, if any, we are collecting at the time.  ",Practice not covered
10839,116,9,Practice not covered,1259,"Our Web site includes social media features including the Facebook Like button and widgets, such as the Share this button or other interactive mini-programs that run on our site (the ""Social Media Features""). These features may collect your IP address, which page you are visiting on our site, and may set a cookie to enable the feature to function properly. Social Media Features are either hosted by a third party or hosted directly us. Your interactions with these Social Media Features are governed by the privacy policy of the company providing it.  ",Practice not covered
10928,116,20,Practice not covered,1259," Will The Motley Fool Disclose Any of Your Personal Information-    The Motley Fool will not disclose any personally identifiable information about individual users, except as described in this Privacy Statement. With the few exceptions that we explain here, we do not give, rent, lend, or sell individual information to our advertisers, although we do provide aggregate information. For example, we might tell an advertiser that there are 120,000 Registered Fools in Gotham City, but we will not tell them that Batman is one of them, nor will we tell them that his email address is bruce@statelywaynemanor.com. We may also use this aggregated information to help the advertisers reach the kind of audience they want. They may give us an ad and tell us the type of audience they want to reach (for example, males in the 22314 ZIP code). The Motley Fool (or people working on our behalf, under contracts and confidentiality agreements) would then take the ad and display it to users who have told us they meet those criteria. We may also disclose aggregate information (for example, information showing that 35 million of our readers clicked on a particular Web advertising banner last month) in order to describe our services to prospective partners, advertisers, and other third parties, and for other lawful purposes.  ",Practice not covered
10972,116,24,Practice not covered,1259,"  If you sign up for a service that relies upon third parties for important elements, we will provide your personal information to the third parties so that they can provide you with their services, and those companies will treat the data under their own policies. We will tell you about these service providers at the time you sign up for the service.  ",Practice not covered
11006,116,31,Practice not covered,1259,"  We may disclose personal information in some other limited circumstances, but we will specifically describe them to you when we collect the information, such as in the rules of a contest or a new service. For example, if we are going to give personal information to a contest's sponsor, we will disclose it when you sign up for the contest, so that you can decide whether to enter.  ",Practice not covered
11014,116,32,Practice not covered,1259,"  We may employ contractors or other third parties to help with our operations. We may give them access to databases of user information, so that they can perform their services for us, including performing system maintenance, displaying personalized content (such as portfolios), performing list analysis or management, or sending mailings for us from our advertisers. These parties are all subject to confidentiality agreements that restrict their use and disclosure of information they obtain through their relationship with The Motley Fool.  ",Practice not covered
11021,116,33,Practice not covered,1259,"  The ads appearing on this Web site are delivered to you by our Web advertising partners. Information about your visits to Fool.com and our partner sites, such as the number of times you have viewed an ad (but not your name, address, or other personal information), is used to serve ads to you. For more information about DoubleClick and how to opt-out of their tracking methods, please click here. For more information about AOL, including how to opt-out of their tracking methods, please click here. For more information about Advertising.com, and their opt-out methods, click here. For more information about opting out of advertising generally, please click here.  ",Practice not covered
10219,121,48,Practice not covered,1259," Does The Motley Fool Participate in the Safe Harbor Program-    The Motley Fool complies with the US-EU Safe Harbor Framework and the US-Swiss Safe Harbor Framework as set forth by the U.S. Department of Commerce regarding the collection, use, and retention of personal information from European Union member countries and Switzerland. The Motley Fool has certified that it adheres to the Safe Harbor Privacy Principles of notice, choice, onward transfer, security, data integrity, access and enforcement. To learn more about the Safe Harbor program, and to view our certification, please visit www.export.gov/safeharbor/.  ",Practice not covered
10200,121,50,Practice not covered,1259,"Also please be aware that when you post messages on our discussion boards, people can respond to your posts through our ""Reply to Author"" email function. Of course, they still will not know your email address (unless you send email to them).  ",Practice not covered
10197,121,53,Practice not covered,1259,"Many of our advertisers or partners, such as brokerages, merchants, or data providers, link from our site to areas on their own sites where they sell their own products and services. If you follow links from our site to others, you should be aware that you are doing business with those other sites, which have their own privacy and data collection practices. The Motley Fool has no responsibility or liability for these independent policies (and we may not even know what they are). For more information regarding a site and its privacy policies, check that site.  ",Practice not covered
11093,116,53,Practice not covered,1259,"Many of our advertisers or partners, such as brokerages, merchants, or data providers, link from our site to areas on their own sites where they sell their own products and services. If you follow links from our site to others, you should be aware that you are doing business with those other sites, which have their own privacy and data collection practices. The Motley Fool has no responsibility or liability for these independent policies (and we may not even know what they are). For more information regarding a site and its privacy policies, check that site.  ",Practice not covered
22979,121,2,Practice not covered,635,"This Privacy Statement and the certification seal located to your right confirms that SCEA is a valid licensee and participating member in the Entertainment Software Rating Board's Privacy Online Program: ESRB Privacy Online. To protect your privacy to the maximum extent possible, we have undertaken this privacy initiative and our websites have been reviewed and certified by ESRB Privacy Online to meet established online information collection and use practices. As part of the privacy program, we are subject to frequent audits of our sites and other enforcement and accountability mechanisms administered independently by ESRB.  ",Practice not covered
15329,103,7,Practice not covered,635,"Links   SCEA may provide links to the websites of our promotional partners and licensed software publishers, our affiliates or other entities that we own or control. This privacy policy does not apply to third-party websites and treatment of any personal information you provide on those sites is subject to the applicable third party's individual privacy policy.  ",Practice not covered
22991,121,10,Practice not covered,635,"Some of our website activities require that the user log in using a PlayStationNetwork (""PSN"") account; for information regarding SNEA's collection of information in association with a Sony Entertainment Network account, please see their Privacy Policy http://www.qriocity.com/us/en/legal-privacy. On our websites, PlayStation Network log in information is being authenticated by SNEA, not SCEA.  ",Practice not covered
22992,121,11,Practice not covered,635,"SCEA may require a Sony Entertainment Network account in connection with:   Participation in online contests, sweepstakes or other promotions  Inclusion in our email newsletter program  Participation on our message boards  Access to special sections of official game websites ",Practice not covered
23011,121,19,Practice not covered,635,"Consumers who voluntarily provide personally identifying information via our website for purposes of receiving marketing materials or who opt-in to receiving marketing materials when they register a Network Adaptor (Ethernet/Modem)(for PlayStation2) or PlayStation2 with integrated network and line connectors for online gaming through the Online Start-Up Disc, become members of our marketing program.  ",Practice not covered
23030,121,30,Practice not covered,635,"We do not control our affiliates' or third parties' use of your information after we share it, but we use reasonable efforts to obtain our affiliates' and third parties' agreement to protect the confidentiality, security, and integrity of any personal information we share with them or that we permit them to collect directly. If consumers do not want their personal information made available to others in these ways, they should not provide their personal information to us.  ",Practice not covered
23032,121,36,Practice not covered,635,"We treat personally identifying information submitted to us for business purposes differently from information we receive in a non-business capacity. We may share resumes or potential developer contact information submitted to us, for example, with other Sony companies or third parties, depending on the nature of the inquiry.  ",Practice not covered
23039,121,39,Practice not covered,635,"Transfer of Your Information in the Event of Sale or Acquisition   In the event that SCEA sells or transfers its business or its business is acquired, our website visitors' stored personally identifying information may be transferred to the purchasing or acquiring entity. Please be aware that accepting this privacy policy means that you also consent to the possible transfer of your personally identifying information outside your country of residence.  ",Practice not covered
24286,118,2,Practice not covered,331," LOGGING IN TO MOBILE APPLICATION    When you log in to our mobile application, you will be asked whether you want the mobile application to remember you. If you choose yes, the mobile application will remain logged in to your information. At any time you can choose to log out by choosing the logout button on the application.  ",Practice not covered
24296,118,4,Practice not covered,331," WHAT INFORMATION DO WE COLLECT?    We collect information in several different ways. We collect the domain name of visitors to our web pages, user-specific information on the pages visitors access, and information such as survey information or other information that you provide voluntarily. Like many other commercial websites, our website may employ a standard technology called a ""cookie"" to collect information about how our site is used. Our website provides a direct link (among others) to the TGI Fridays Give Me More Stripes Guest Recognition Program site ( www.givememorestripes.com) where, should you choose to enroll, you will be asked to submit personal information, which will be subject to the Give Me More Stripes terms and conditions, separate privacy policy and other policies. Our mobile application also allows enrollment in the Give Me More Stripes program by providing the same information. In addition, we may from time to time provide direct links to news or promotional sites featuring articles about TGI Fridays, which would be subject to those sites' policies.  ",Practice not covered
