annotation_ID,annotator_ID,segment_ID,category,policy_ID,segment_text,Other Type
12423,116,6,Practice not covered,746," Ratings and Other Interactive Features    When you participate in certain interactive features on our site, such as using our recipe exchange, recipe ratings and product ratings and reviews, you may submit information and content, such as recipes, ratings, comments, pictures, etc. to the site. You may also provide us with certain information like your e-mail address, nickname, city and state of residency. We may use this information to contact you about the content you have provided or to post with your content. Remember that what you post or upload to the site will be publicly available, so please exercise caution when deciding whether to disclose anything personal about yourself. Kraft cannot control the actions of third parties who may view the website and use publicly-available information for their own purposes.  ",Practice not covered
13225,121,15,Practice not covered,746," Tracking Options    You can set your Internet browser settings to stop accepting new cookies, to receive notice when you receive a new cookie, to disable existing cookies, and to omit images (which will disable pixel tags). Note that the opt-out will apply only to the browser that you are using when you adjust your tracking settings or cookie preferences. Our system may not respond to Do Not Track requests or headers from some or all browsers. You can learn more about and opt out from receiving third party advertiser cookies by visiting the Digital Advertising Alliance's opt-out page here. Without cookies or pixel tags though, you may not be able to take full advantage of all of Kraft's website features. We adhere to the Digital Advertising Alliance Self-Regulatory Principles for Online Behavioral Advertising.  ",Practice not covered
12102,118,15,Practice not covered,746," Tracking Options    You can set your Internet browser settings to stop accepting new cookies, to receive notice when you receive a new cookie, to disable existing cookies, and to omit images (which will disable pixel tags). Note that the opt-out will apply only to the browser that you are using when you adjust your tracking settings or cookie preferences. Our system may not respond to Do Not Track requests or headers from some or all browsers. You can learn more about and opt out from receiving third party advertiser cookies by visiting the Digital Advertising Alliance's opt-out page here. Without cookies or pixel tags though, you may not be able to take full advantage of all of Kraft's website features. We adhere to the Digital Advertising Alliance Self-Regulatory Principles for Online Behavioral Advertising.  ",Practice not covered
13243,121,17,Practice not covered,746," How We Use Your Information    We may use the information we collect from and about you to contact you from time to time. For example, we may send you promotional offers, materials, and other communications and information about Kraft, its portfolio of brands and its partners. You may receive these offers in advertising that is directed to you via third party sites and media platforms, including in social media. We may respond to your comments or questions, or contact you if needed while processing a product or service you requested through our website. We also may use the information you provide to contact you for your opinions on Kraft products, services or websites. As described in this Privacy Notice, we also use the information we collect about you to improve our website, products and services, and to deliver content that is customized to your interests.  ",Practice not covered
13266,121,22,Practice not covered,746,"During the normal course of our business, Kraft may sell or purchase assets. If another entity acquires us or any of our assets, information we have collected about you may be transferred to such entity. In addition, if any bankruptcy or reorganization proceeding is brought by or against us, such information may be considered an asset of ours and may be sold or transferred to third parties. Should a sale or transfer occur, we will use reasonable efforts to try to require that the transferee use personally identifiable information provided through this website in a manner that is consistent with this Privacy Notice.  ",Practice not covered
12544,116,22,Practice not covered,746,"During the normal course of our business, Kraft may sell or purchase assets. If another entity acquires us or any of our assets, information we have collected about you may be transferred to such entity. In addition, if any bankruptcy or reorganization proceeding is brought by or against us, such information may be considered an asset of ours and may be sold or transferred to third parties. Should a sale or transfer occur, we will use reasonable efforts to try to require that the transferee use personally identifiable information provided through this website in a manner that is consistent with this Privacy Notice.  ",Practice not covered
12164,118,22,Practice not covered,746,"During the normal course of our business, Kraft may sell or purchase assets. If another entity acquires us or any of our assets, information we have collected about you may be transferred to such entity. In addition, if any bankruptcy or reorganization proceeding is brought by or against us, such information may be considered an asset of ours and may be sold or transferred to third parties. Should a sale or transfer occur, we will use reasonable efforts to try to require that the transferee use personally identifiable information provided through this website in a manner that is consistent with this Privacy Notice.  ",Practice not covered
13269,121,24,Practice not covered,746, Links To Other Websites    This website may contain links to other websites. We provide these links solely for your convenience and information. Different websites have different privacy practices. You should always check the privacy notice of the specific site you're visiting to understand the privacy practices associated with that site. We are not responsible for the content or privacy practices of third party websites.  ,Practice not covered
12546,116,24,Practice not covered,746, Links To Other Websites    This website may contain links to other websites. We provide these links solely for your convenience and information. Different websites have different privacy practices. You should always check the privacy notice of the specific site you're visiting to understand the privacy practices associated with that site. We are not responsible for the content or privacy practices of third party websites.  ,Practice not covered
12556,116,28,Practice not covered,746," How We Protect Your Information    The security of personally-identifiable information is important to us. We maintain administrative, technical and physical safeguards to protect against unauthorized use, disclosure, alteration or destruction of the personally-identifiable information we collect on this website. While we make every effort to help ensure the integrity and security of our network and systems, we cannot guarantee our security measures.  ",Practice not covered
19902,103,2,Practice not covered,1636,Our Web Sites may contain links to other websites for your convenience and information. We are not responsible for the privacy practices or the content of those websites.  ,Practice not covered
22433,118,2,Practice not covered,1636,Our Web Sites may contain links to other websites for your convenience and information. We are not responsible for the privacy practices or the content of those websites.  ,Practice not covered
22576,118,8,Practice not covered,1636,"When you share (with or without adding your own comments) any of our Web Sites' articles or content on a social media platform, that action is governed by such social media platform's privacy policy. We do not record those comments. For example, when you share content from our Web Sites on your Facebook profile, that action is governed by the Facebook Privacy Policy.  ",Practice not covered
22453,118,9,Practice not covered,1636,"We have engaged with a third party service called AddThis to provide us information, reports and analysis about users' engagement with our content. All data collected by AddThis on our behalf is owned and used by us. For more information about how AddThis collects data, please read their privacy policy at http://www.addthis.com/privacy.  ",Practice not covered
22456,118,10,Practice not covered,1636,"Contests, Sweepstakes and Promotions   SIDEARM Entities may collect personal information from you when you participate in sweepstakes, contests or special promotions. If this information is also being collected by a third party other than SIDEARM Sports, we will notify you at the same time. If you do not want any personal information shared, you should not participate in the sweepstakes, contest or promotion.  ",Practice not covered
22466,118,12,Practice not covered,1636, Non-Personal Information Collected Using Technology    Information We Collect Using Technology   We use various Internet technologies to manage and track use of the SIDEARM Services. Non-personal information that we collect using these technologies may be combined with other information about you.  ,Practice not covered
22477,118,16,Practice not covered,1636,"Analytics Technologies. We have engaged with a third party service called Google Analytics to provide us information, reports and analysis about the usage, browsing patterns of users of the SIDEARM Services. Google Analytics tracks and analyzes non-personally identifiable usage and volume statistical information from our visitors and customers on our Web Sites. All data collected by Google Analytics on our behalf is owned and used by us. For more information about how Google Analytics collects data, please read their privacy policy at http://www.google.com/intl/en/policies/privacy/.  ",Practice not covered
22488,118,20,Practice not covered,1636,"Ads may be displayed within our apps. The ads you see may be targeted to you based on your current GPS location, proximity of your device to an active beacon or low-energy blue-tooth transmitter, your device's IP address or ZIP code and user provided location information such as seat location. Some mobile applications promoted through the SIDEARM Services may be links to Third-party services, such services shall be governed by their privacy policy.  ",Practice not covered
19939,103,22,Practice not covered,1636,"We do not have access to, nor control over, advertisers' or service providers' use of cookies or other tracking technologies or how they may be used.  ",Practice not covered
22498,118,22,Practice not covered,1636,"We do not have access to, nor control over, advertisers' or service providers' use of cookies or other tracking technologies or how they may be used.  ",Practice not covered
22524,118,30,Practice not covered,1636,We also share information about our audience in aggregate or de-identified form. Nothing in this Privacy Policy is intended to restrict our use of aggregated or de-identified information in any way.  ,Practice not covered
22530,118,35,Practice not covered,1636,"OUR EMAIL POLICY   SIDEARM Sports complies with the federal CAN-SPAM Act of 2003. We will not send you marketing messages if you have opted out. We will not share, sell, rent, swap or authorize any third party to use your email address for commercial purposes without your permission. If you feel you have received an email from us in error, please contact us at sidearm@sidearmsports.com.  ",Practice not covered
22585,118,40,Practice not covered,1636,"HTML Email. When you sign up to receive email from us, you can select either plain text or HTML (with images) format. If you select the HTML format, we may place a one-pixel gif to determine whether or not readers viewed the email. This process does not leave any information on your computer, nor does it collect information from your computer. We may share this data with others in aggregate only.  ",Practice not covered
22540,118,41,Practice not covered,1636,"Emails From You. If you send us emails, you should be aware that information disclosed in emails may not be secure or encrypted and thus may be available to others. We suggest that you exercise caution when deciding to disclose any personal or confidential information in emails. We will use your email address to respond directly to your questions or comments.  ",Practice not covered
22603,118,48,Practice not covered,1636,"For children under the age of 13, parents will initially provide certain personal information about or for their child; we will not collect it from the child directly. If a child under age 13 then participates in any ongoing activity that requires the collection, retention, and use of personal information in addition to what has already been provided or authorized by the parent, we will also ask for a parent's e-mail address so that we can notify the parent that we have received personal information from their child and seek consent to retain this information. We do not knowingly collect names and e-mail addresses or other personally identifying information from children under age 13 for these types of activities without notifying the parent via e-mail and giving the parent the option to remove their child's e-mail address from the applicable database for that activity.  ",Practice not covered
22560,118,50,Practice not covered,1636,"Your California Privacy Rights   Under the California ""Shine The Light"" law, California residents may opt-out of SIDEARM's disclosure of personal information to third parties for their direct marketing purposes. As detailed above, you may choose to opt-out of the sharing of your personal information with third parties for marketing purposes at any time by submitting a request in writing to SIDEARM Sports, 335 Hinds Hall, Syracuse NY 13244 or by emailing us at sidearm@sidearmsports.com. It is important to note that this opt-out does not prohibit disclosures made for non-marketing purposes.  ",Practice not covered
24344,118,5,Practice not covered,503,"In some cases, we may also collect information from third-party sources, including social media sites and other sites with which we may partner on BWW branded promotions. For example, if you post a comment on our Facebook page or send us a message on Twitter, we may collect and use that information as described in this Privacy Policy. Please note that we may combine this information with other information that we collect about you and use it as described herein.  ",Practice not covered
24398,118,6,Practice not covered,503," What We Do With What We Collect    We use the personal information we collect for various purposes, including to complete a purchase that you initiate, to respond to your requests for information, to manage our Sites, to allow you to participate in electronic activities, marketing analysis, marketing communications, facilitating loyalty programs, and for other lawful purposes. From time to time, we may also contact customers by email, phone or mail for such purposes as to inform them of new products, services and special offers, administer a survey, or to follow up on previous interactions. If you do not wish to receive such communications from us, please follow the opt-out instructions generally provided in such communications. Upon your request, we will make reasonable efforts to delete your personal information from our database, however, it may be impossible to delete your entry without retaining some residual information for a period of time due to backups and records of deletion. Be assured that we will never knowingly send messages to customers who have asked not to receive them.  ",Practice not covered
24355,118,10,Practice not covered,503," Links and Third-Party Content    Our Sites may contain links to other websites, which are not under our control. We provide these links as a customer convenience and to allow advertisers to promote their own sites or products, and do not endorse those sites, companies or their products or services. Also, when you link to our Sites from another site, the originating site may collect information about you. We do not review, control or monitor the practices, information or materials on any other websites, and are not responsible or liable for the communications, practices, information, content or materials from any of those sites. You are responsible for understanding and adhering to any other website's terms and conditions.  ",Practice not covered
13460,103,17,Practice not covered,503,"This Privacy Policy was last updated on: July 23, 2012.  ",Practice not covered
18111,103,1,Practice not covered,1673,"Welcome to Tulsaworld.com, home of the Tulsa World Online Edition. References in this Privacy Policy to Tulsaworld.com or this ""Website"" include the webpages that are directly accessed through the navigation bars on Tulsaworld.com which have a direct link to this Privacy Policy. There may be some webpages or sections of Tulsaworld.com which are directly accessed through the navigation bar on Tulsaworld.com which are maintained by third parties with whom we have a business relationship. These webpages may link to a separate privacy policy maintained by that third party. If you are not sure if this privacy policy applies to any webpage directly accessed through Tulsaworld.com, you should click on the privacy policy link at the bottom of the webpage, or you may contact Tulsaworld.com as set forth at the end of this policy.  ",Practice not covered
21795,118,1,Practice not covered,1673,"Welcome to Tulsaworld.com, home of the Tulsa World Online Edition. References in this Privacy Policy to Tulsaworld.com or this ""Website"" include the webpages that are directly accessed through the navigation bars on Tulsaworld.com which have a direct link to this Privacy Policy. There may be some webpages or sections of Tulsaworld.com which are directly accessed through the navigation bar on Tulsaworld.com which are maintained by third parties with whom we have a business relationship. These webpages may link to a separate privacy policy maintained by that third party. If you are not sure if this privacy policy applies to any webpage directly accessed through Tulsaworld.com, you should click on the privacy policy link at the bottom of the webpage, or you may contact Tulsaworld.com as set forth at the end of this policy.  ",Practice not covered
21646,118,14,Practice not covered,1673,"From time to time, Tulsaworld.com will conduct surveys on its site for research purposes. When you participate in a survey, the information you provide about yourself and your responses are collected by Tulsaworld.com. We will always inform you how we will use this information.  ",Practice not covered
21663,118,16,Practice not covered,1673,"Tulsaworld.com also tracks and collects non-personally identifiable information which does not identify a specific visitor. Non-personally identifiable information may include the Uniform Resource Locator (""URL"") of the website your visited before coming to our Website, the URL of the website you visit after leaving our Website, the type of browser you are using and your Internet Protocol (""IP"") address. Tulsaworld.com tracks computer IP addresses to help with system administration and to compile information about traffic patterns on the site. Computer IP addresses identify computers and the networks or Internet service providers to which they are connected. We, and/or our authorized third party service providers and advertisers, may automatically collect this information when you visit our Website through the use of electronic tools like cookies and web beacons or pixel tags, as described below. We use non-personally identifiable information to troubleshoot, administer the Website, analyze trends, gather demographic information, comply with applicable law, and cooperate with law enforcement activities. We may also share this information with our authorized third party service providers and advertisers to measure the overall effectiveness of our online advertising, content, and programming.  ",Practice not covered
18710,103,34,Practice not covered,1673,"Information that you might post on a message board, forum, or chat room is not protected under this privacy policy. Information posted in any of these public areas is not considered confidential communication. Tulsaworld.com has the right but not the obligation to monitor the content of its bulletin boards, forums and chat rooms to determine compliance with its policies and terms of use and any other operating rules established for the website. Tulsaworld.com shall have the right in its sole discretion, and without prior notice, to edit, refuse to post, or remove any materials submitted to or posted to its bulletin boards, forums, or chat rooms.  ",Practice not covered
21772,118,34,Practice not covered,1673,"Information that you might post on a message board, forum, or chat room is not protected under this privacy policy. Information posted in any of these public areas is not considered confidential communication. Tulsaworld.com has the right but not the obligation to monitor the content of its bulletin boards, forums and chat rooms to determine compliance with its policies and terms of use and any other operating rules established for the website. Tulsaworld.com shall have the right in its sole discretion, and without prior notice, to edit, refuse to post, or remove any materials submitted to or posted to its bulletin boards, forums, or chat rooms.  ",Practice not covered
18725,103,47,Practice not covered,1673,Refunds   Tulsa World will charge a $5 processing fee for refunds remitted to the customer.,Practice not covered
21763,118,47,Practice not covered,1673,Refunds   Tulsa World will charge a $5 processing fee for refunds remitted to the customer.,Practice not covered
25338,118,12,Practice not covered,1618,"Cookies and Web Beacons: Cookies are used to store and track information about you. A cookie is a small amount of data that is sent to your browser from Web sites and stored on your computer's hard drive. Cookies are used to deliver targeted advertising based on your behavior and demographics and to track your entries in promotions and contests. Cookies may be linked to PIN. In addition, MediaNews uses web beacons provided by third-party advertising companies to help manage our online advertising. Web beacons enable us to recognize a browser's cookie when a browser visits a MediaNews Web site, and to learn which banner ads bring users to MediaNews Web sites. MediaNews websites have two third-party web advertising companies, Yahoo! and DoubleClick, which may place or recognize a unique cookie on your browser. Yahoo! also may use information regarding its own users to select which ads to display. Click here to learn more about Yahoo!'s ad practices, including how to opt out of using anonymous information to select which ads to show you. For more information about DoubleClick, cookies, and how to ""opt-out"", please click here.  ",Practice not covered
25388,118,17,Practice not covered,1618,"Advertising Third Parties: MediaNews may share PIN and CIN that is collected with third parties hired to perform services on our behalf, including, but not limited to, fulfilling subscription requests, sending e-mails and assisting in the provision of the MediaNews Web sites and services. The ads appearing on MediaNews Web sites are delivered to you by Yahoo! and DoubleClick, our third party web advertising company's. Information about your visits to this site, such as the number of times you have viewed an ad and other information is used to serve ads to you. A MediaNews Group affiliates participates in the APT from Yahoo! platform and Yahoo! is an ad network partner to display ads on our sites. Yahoo! is an ad network partner that displays ads on MediaNews websites. To improve your ad experience on MediaNews websites and elsewhere on the Internet, we may send non-personal information to Yahoo! based on your browser's activities, such as type of pages viewed and categories of interests, so that the advertising you see is relevant to you. Yahoo! also may use information regarding its own users to select which ads to display. Click here to learn more about Yahoo!'s ad practices, including how to opt out of using anonymous information to select which ads to show you.  ",Practice not covered
25391,118,18,Practice not covered,1618,"Yahoo! is an ad network partner that displays ads on MediaNews Web sites. To improve your ad experience on MediaNews Web sites and elsewhere on the Internet, we may send non-personal information to Yahoo! based on your browser's activities, such as type of pages viewed and categories of interests, so that the advertising you see is relevant to you. Yahoo! also may use information regarding its own users to select which ads to display. Click here to learn more about Yahoo!'s ad practices, including how to opt out of using anonymous information to select which ads to show you.  ",Practice not covered
